poem,all,coherent,grammatical,melodious,moved,real,rhyming,readable,comprehensible,intense,liking
"yet in the virgin writing felt the air <br>one object only might in one great praise <br>pity , as a form , he would have scarred <br>like silken looks fast sleeping by wood 's hillside",-0.5555555555555556,-1.0,0.0,-0.5,0.0,0.0,-1.0,-1.0,-0.5,-1.0,-0.5
"without this very little southern blot, <br>that only causes cell biology, <br>not even other humans gonna rot ! <br>we never know about my human body. <br><br>is there too many people facing grains ! <br>i wanna see another penicillin ! <br>a broken body under acid stains ! <br>and banging on an empty cell division.",0.14814814814814814,0.5,0.0,-0.16666666666666666,0.16666666666666666,0.16666666666666666,0.16666666666666666,0.16666666666666666,-0.16666666666666666,0.5,0.3333333333333333
"when the sun 's low ray in the sky . <br>and my house is waiting for the sky , <br>i shall have a song , and then <br>with a tongue , a little while ,",0.6296296296296297,1.0,0.3333333333333333,0.3333333333333333,0.3333333333333333,1.0,0.3333333333333333,0.3333333333333333,1.0,1.0,0.3333333333333333
the castle of our desire vultures we must be seen <br>the castle with a watery lustre on the floor <br>and the wanderer to the steps of the wand <br>with all her cruell wand'rer as he rides along <br>the meanest serf on sir launfal,-0.22875816993464052,-0.17647058823529413,0.17647058823529413,-0.17647058823529413,-0.29411764705882354,-0.4117647058823529,-0.4117647058823529,-0.17647058823529413,-0.4117647058823529,-0.17647058823529413,-0.29411764705882354
"bear witness , once my comrades , what a hard-bit gang were we —<br>the servants of the sweep-head , but the masters of the sea !<br>by the hands that drove her forward as she plunged and yawed and<br>sheered ,<br>woman , man , or god , or devil , was there anything we feared ?",-0.24444444444444444,-0.2,-0.6,-0.2,-0.6,-0.6,-0.6,-0.2,0.2,0.6,-0.2
"the day of the world shall come , and the world is free ! <br>i am not longer , my love , <br>and the simple power of all the rest . ” <br>the spirit of the silver",0.2222222222222222,0.2,0.0,0.2,0.0,0.2,0.6,0.4,0.2,0.2,0.6
"because) he always answered better, more,<br>perhaps, because he always answered( track,<br>before and after, progress, any score,<br>before, before the picture, any, all,<br>before the pictures ever happened) he,<br>because the picture always happens small,<br>because the picture always happened free,<br>because he only answered free because,<br>because, because. because because he draws.",-0.05555555555555555,-0.16666666666666666,0.0,-0.3333333333333333,0.16666666666666666,0.16666666666666666,-0.16666666666666666,-0.16666666666666666,0.3333333333333333,-0.3333333333333333,0.16666666666666666
"about an unemployment compensation. <br>is wrong but then some kids have fluent speakers, <br>their latest music on discrimination ! <br>they really wanna try to battle preachers. <br><br>we know another very lesson plan ! <br>as when the only little alto clef, <br>would ever mention me and horace mann ! <br>or see a million women getting deaf.",-0.05555555555555555,0.0,0.5,0.5,0.0,-0.5,0.0,0.0,-0.5,-0.5,0.0
"and when the child grew strive ,<br>and all the anguish become man .<br>we use his master<br>to earth and older , has they sink the horns .<br>the river comes , now still far , still comes clear ,<br>hear the clear feels",0.3333333333333333,0.3333333333333333,1.0,1.0,1.0,0.3333333333333333,0.3333333333333333,-1.0,0.3333333333333333,-0.3333333333333333,-0.3333333333333333
"it is because the ships beside the shore<br>spread their dark sails to the sea-blowing breeze ;<br>the tide is high , and soon will set toward the distant islands ,<br>and there is a gleam of swords and armour ,<br>for the soldiers go to war beyond the seas .",0.48148148148148145,-0.3333333333333333,1.0,0.3333333333333333,-0.3333333333333333,1.0,1.0,1.0,0.3333333333333333,0.3333333333333333,-0.3333333333333333
"the castle of our desire vultures we must be seen <br>the castle with a watery lustre on the floor <br>and the wanderer to the steps of the stones <br>with allrespect, as he ne'er unworthy are of praise <br>‘ tiske the modest proportions to",-0.30434782608695654,-0.30434782608695654,-0.13043478260869565,-0.30434782608695654,-0.13043478260869565,-0.21739130434782608,-0.4782608695652174,-0.6521739130434783,-0.30434782608695654,-0.21739130434782608,-0.391304347826087
"o night , hide me in your long cold arms :<br>let me sleep , but let me not live this life !<br>there are too many people with haggard eyes standing<br>before me<br>saying , “ to live you must suffer even as we . ”",0.022222222222222223,0.0,-0.2,0.2,0.2,0.2,-0.2,-0.2,0.4,-0.2,0.4
"i sang a little bird <br>beneath the moon , <br>and the wind has a rose on the shore , <br>and the eye of the sun in the sky ,",-0.4074074074074074,0.3333333333333333,-0.3333333333333333,-1.0,0.3333333333333333,-0.3333333333333333,-1.0,-0.3333333333333333,-1.0,-0.3333333333333333,-0.3333333333333333
"the world was in its day of peril dark and glorious <br>wont to believe the dot of fond love, with one <br>in the dawn of the very same ; and when the storm <br>in one dim bourne, from starry bade, iove's eye <br>that looked and",-0.21481481481481482,-0.4666666666666667,-0.06666666666666667,-0.4666666666666667,-0.2,-0.6,-0.06666666666666667,0.2,-0.3333333333333333,0.06666666666666667,-0.4666666666666667
"as you forgot i may forget ,<br>when summer dews cease to be wet .<br>when whippoorwills disdain the night ,<br>when sun and moon are no more bright ,<br>and all the stars at midnight set .",-0.037037037037037035,1.0,-0.3333333333333333,0.3333333333333333,0.3333333333333333,0.3333333333333333,-1.0,-0.3333333333333333,0.3333333333333333,-1.0,0.3333333333333333
"they are not dead , nor thousands of death ; <br>‘ tis not that the earth is not there . <br>then the same gray fox <br>that cannot be done .",-0.3333333333333333,-0.3333333333333333,-0.3333333333333333,-1.0,1.0,-0.3333333333333333,-1.0,-0.3333333333333333,-0.3333333333333333,-0.3333333333333333,-1.0
"a smoky rock had hung so sternly low<br>and silent, on this towering vale below<br>the forest in track on the natal shore<br>his accents fell, an angel was before",0.05982905982905983,0.07692307692307693,0.23076923076923078,0.23076923076923078,-0.5384615384615384,0.5384615384615384,0.07692307692307693,0.07692307692307693,0.07692307692307693,-0.23076923076923078,0.23076923076923078
"the castle of our desire vultures we must be seen <br>the castle with a watery lustre on the floor <br>and the wanderer to the steps of the stones <br>with allrespect, as he ne'er unworthy are of praise <br>‘ tiske the modest and sun",-0.26570048309178745,-0.4782608695652174,-0.043478260869565216,-0.13043478260869565,-0.4782608695652174,-0.4782608695652174,-0.4782608695652174,-0.21739130434782608,0.043478260869565216,-0.13043478260869565,-0.4782608695652174
"but i advise against resistance. we,<br>the chosen ones of heaven must have kiss.<br>the children must obey and never see,<br>remember nothing. only heaven knows.<br>remember only that, remember. we,<br>however many people suffer blows,<br>believe that only heaven judges me.<br>remember also that the very fact,<br>whoever judges, judges, judges) act.",0.18518518518518517,0.3333333333333333,-0.3333333333333333,1.0,0.3333333333333333,0.3333333333333333,1.0,-0.3333333333333333,-1.0,0.3333333333333333,0.3333333333333333
"references : masson 's life and times of john milton ; milton<br>( classical writers ) , by stopford brooke ; milton ( english men of<br>letters ) , by mark pattison ; macaulay 's essay on milton ; de quincey ,<br>milton vs. southey and landor ; coleridge 's literary remains ;<br>johnson 's lives of the poets ; hazlitt 's english poets .",-0.7037037037037037,-0.3333333333333333,-0.3333333333333333,-1.0,-1.0,-0.3333333333333333,-1.0,-0.3333333333333333,-1.0,-1.0,-1.0
"where will-o ’ - the-wisps and glow-worms shine ,<br>in bulrush and in brake ;<br>where waving mosses shroud the pine ,<br>and the cedar grows , and the poisonous vine<br>is spotted like the snake ;",0.3333333333333333,0.3333333333333333,0.3333333333333333,1.0,-0.3333333333333333,0.3333333333333333,-0.3333333333333333,1.0,0.3333333333333333,0.3333333333333333,0.3333333333333333
"the castle of our desire vult, and we desire <br>we should a drink, as full, as dry, and as indeed <br>we cannot touch the tables, as indeed they are <br>the stay of queens above, and list to adventures of men <br>with flowing water and a listless store",-0.2,0.0,-0.2,-0.4,-0.2,-0.2,-0.2,-0.2,0.0,-0.4,0.0
"and they live by nature 's lord 's their own <br>nor know the though stretched of too short to fall <br>not blind therewith the herd for their pow'r <br>at twelve o'clock , to find them all",0.022222222222222223,0.0,0.2,0.4,0.0,0.8,0.2,-0.4,-0.4,-0.6,0.0
"the world was in its day of peril dark and glorious <br>wontian, marsepulchral, helen we were sons <br>in the lone sky and in the aisles stretch of dreams <br>but when the shades of death did not set <br>her eyes were dazzled,",-0.022222222222222223,-0.6,-0.2,-0.6,-0.2,-0.2,0.2,0.6,-0.2,1.0,-0.6
"i do not ask for me a thing , <br>and i 'll be a boy , as i am here , <br>and i am weary , and my heart and soul , <br>i will not go .",0.4074074074074074,1.0,-0.3333333333333333,-1.0,1.0,0.3333333333333333,1.0,1.0,1.0,-0.3333333333333333,-0.3333333333333333
"then let us all most merry be ,<br>and sing with cheerful voice ,<br>for we have good occasion now<br>this time for to rejoice .<br>for , etc .",0.25925925925925924,-1.0,1.0,0.3333333333333333,0.3333333333333333,1.0,0.3333333333333333,-0.3333333333333333,0.3333333333333333,0.3333333333333333,0.3333333333333333
"the castle of our desire vultures we must be seen <br>the castle with a watery lustre on the floor <br>and the wanderer to the steps of the stones <br>with allrespect, as he who with his maker knew <br>the gorge with ferns and more desired, he",-0.19111111111111112,-0.36,0.04,-0.44,-0.2,-0.28,-0.04,0.12,-0.12,-0.44,-0.2
"from the to a little boat ,<br>the dawn , the blue and real his voice ,<br>the angry widow breast ;<br>but sound brilliant voice his silly deadlier ancient do<br>thy due , and cannot save<br>if god pierce wanting , that we show ? we",0.48148148148148145,1.0,-0.3333333333333333,1.0,1.0,0.3333333333333333,0.3333333333333333,0.3333333333333333,0.3333333333333333,0.3333333333333333,1.0
"surrounded by my greatest millionaire, <br>i hid behind this pretty small cafe ! <br>no one who ever had an empty chair ! <br>was very busy selling triple j. <br><br>and people having talent competition. <br>with fifty hundred million featuring, <br>for any famous little paris hilton ! <br>to show the world of other teams competing.",0.48148148148148145,0.3333333333333333,1.0,0.3333333333333333,-0.3333333333333333,1.0,1.0,0.3333333333333333,1.0,-0.3333333333333333,0.3333333333333333
"the castle of our desire vultures we should defend <br>and blot the modest el vines with fraternal rage <br>spread like a bessoon by the siciest women's malice rear <br>the castle snowed columns, lest it should fall <br>his ruinic heat should stain the modest air",-0.25252525252525254,-0.45454545454545453,-0.6363636363636364,-0.2727272727272727,0.2727272727272727,-0.45454545454545453,-0.2727272727272727,-0.09090909090909091,-0.8181818181818182,0.45454545454545453,0.09090909090909091
"and next is the island-of-lullaby ,<br>and every one there rejoices .<br>the winds are only a perfumed sigh ,<br>and the birds that sing in the treetops try<br>to imitate mothers ’ voices .",0.7777777777777778,1.0,1.0,0.3333333333333333,0.3333333333333333,1.0,1.0,1.0,1.0,0.3333333333333333,0.3333333333333333
"the breed's described : now, with a merrynet <br>and a wintery bier than enough and shall be <br>in winter and in solitude ; the winter's gone <br>and the zumber is in the lily and the snow <br>here too the verdure of the gather",-0.2,-0.8,0.0,0.0,0.2,-0.4,-0.6,-0.2,0.0,0.0,0.2
"saw ye my saviour ? heard ye the glad sound ?<br>felt ye the power of the word ?<br>‘ twas the truth that made us free ,<br>and was found by you and me<br>in the life and the love of our lord .",-0.4,-0.4,-0.4,-0.8,-0.2,-0.2,-0.8,-0.2,0.0,-0.6,-0.2
"is dreaming here, perhaps about the mind,<br>about becoming conscious of the true,<br>the beauty of the world, about his kind,<br>about the nature, nature poet, who,<br>like plato, is himself inside the mind,<br>about the nature of the poems) you,<br>the reader, who believe that poets find,<br>or even must, another world inside,<br>perhaps another language even side.",0.25925925925925924,0.3333333333333333,0.3333333333333333,1.0,-0.3333333333333333,0.3333333333333333,1.0,-0.3333333333333333,-0.3333333333333333,0.3333333333333333,1.0
"“ ‘ here he comes , holds in mouth this time<br>— what may the thing be ? well , that 's prime !<br>now , did you ever ? reason reigns<br>in man alone , since all tray 's pains<br>have fished — the child 's doll from the slime ! ’",0.25925925925925924,-0.3333333333333333,0.3333333333333333,0.3333333333333333,0.3333333333333333,-0.3333333333333333,1.0,0.3333333333333333,0.3333333333333333,0.3333333333333333,0.3333333333333333
"the castle of our desire vultures we must be seen <br>the castle with a watery lustre on the floor <br>and the wanderer to the steps of women, who the stones <br>with stones and fire into the victims find <br>the lily or the lily of the mough",-0.5185185185185185,-0.5,-0.3333333333333333,-0.6666666666666666,-0.6666666666666666,-0.6666666666666666,-0.3333333333333333,-0.5,-0.6666666666666666,-0.3333333333333333,-0.5
"tall butternuts and hickories ,<br>the pawpaw and persimmon trees ,<br>the beech , the chestnut , and the oak ,<br>wall shadows huge , like ghosts of bees<br>through which gold sun-bits soak .",-0.18518518518518517,0.3333333333333333,-1.0,0.3333333333333333,-0.3333333333333333,-0.3333333333333333,0.3333333333333333,-0.3333333333333333,0.3333333333333333,-1.0,-0.3333333333333333
"so the evil 's triumph sendeth , with a terror and a chill ,<br>under continent to continent , the sense of coming ill ,<br>and the slave , where'er he cowers , feels his sympathies with god<br>in hot tear-drops ebbing earthward , to be drunk up by the sod ,<br>till a corpse crawls round unburied , delving in the nobler clod .",-0.1111111111111111,0.3333333333333333,0.3333333333333333,-1.0,-0.3333333333333333,-0.3333333333333333,-0.3333333333333333,-0.3333333333333333,0.3333333333333333,0.3333333333333333,-1.0
"she sang , and the song trembled down to my breast ,—<br>( it was sweet , so sweet the singing . )<br>as a dove just out of its fledgling nest ,<br>and , putting its wings to the first sweet test ,<br>flutters homeward so wearily winging .",0.1623931623931624,-0.07692307692307693,0.07692307692307693,0.38461538461538464,0.38461538461538464,0.07692307692307693,0.38461538461538464,0.23076923076923078,-0.07692307692307693,0.07692307692307693,0.23076923076923078
"and like the pangs which yet cannot retain<br>a god; but and put gently back again<br>let me much only may i say; but i<br>is it to me not, by a moment, die",0.1111111111111111,0.0,0.4,-0.4,0.4,-0.2,0.0,0.2,0.2,0.4,0.0
"the gods have ceased to be <br>a thousand friends , and he loves me to the place <br>of the great bleeding heart to me . <br>what then , how could i be ?",-0.1111111111111111,-1.0,-0.5,0.5,-0.5,0.5,0.0,0.0,0.0,0.0,0.5
"until my mother finally replied, <br>each other night another brother came ! <br>his father had become unsatisfied ! <br>a very little hero soon became. <br><br>and then an evening after day began, <br>he knew what any second life was taking. <br>but then the early morning children ran ! <br>not going back to where they started staying.",0.4074074074074074,0.3333333333333333,0.3333333333333333,1.0,0.3333333333333333,1.0,0.3333333333333333,0.3333333333333333,0.3333333333333333,-0.3333333333333333,0.3333333333333333
"wak è d up by god's presence, with a frown<br>the shadow in herself it was begun<br>and with all on the summer to decay<br>and left me for a little doom away",-0.15555555555555556,0.2,0.0,-0.6,-0.2,-0.4,-0.2,-0.4,0.0,0.2,0.0
"the castle of our desire vultures we must be seen <br>the open ray and the worm within the cave <br>the church might be one lily yet the child of lower <br>who would fain be found by many a varying course <br>thelily could not, till more safe than he",-0.1388888888888889,-0.125,-0.125,-0.375,-0.125,-0.25,0.0,-0.25,0.0,0.0,0.0
"amid me never summer long ago ,<br>hot with devil will be , presence thee ;<br>each day 's us as i go ,<br>and cannot flow in every ” to-day ;<br>we shall not fear that we all different upon earth and dark",0.3333333333333333,-0.3333333333333333,1.0,0.3333333333333333,-0.3333333333333333,0.3333333333333333,1.0,-0.3333333333333333,0.3333333333333333,1.0,0.3333333333333333
"but even after wu di emperor. <br>for those who ever thought was never true, <br>or sleeping by another sacred treasure ! <br>the holy doctor ordered social brew. <br><br>how many people merely eating meat, <br>are you not being mental nor unclean ! <br>no one has given me enough to eat ! <br>too busy eating japanese cuisine.",-0.1111111111111111,0.3333333333333333,-0.3333333333333333,-0.3333333333333333,-0.3333333333333333,-0.3333333333333333,0.3333333333333333,-0.3333333333333333,-0.3333333333333333,0.3333333333333333,-0.3333333333333333
"and wilt the god and such as i may see<br>beloved, this is not a spot of this<br>blest is the art with beauty that to kiss<br>that truth can take, but little as to be",0.4666666666666667,0.6,0.2,0.6,-0.2,0.2,1.0,0.6,1.0,0.2,0.6
"ask if i love thee ? how else could i borrow<br>pride from man 's slander , and strength from my sorrow ?<br>laugh when they sneer at the fanatic 's bride ,<br>knowing no bliss , save to toil and abide<br>weeping by thee .",0.4074074074074074,1.0,0.3333333333333333,0.3333333333333333,1.0,0.3333333333333333,0.3333333333333333,0.3333333333333333,0.3333333333333333,-0.3333333333333333,0.3333333333333333
"the castle of our desire vultures we must be seen <br>the castle with a watery lustre on the floor <br>and the wanderer to the steps of the stones <br>with allrespect, as he ne'er unworthy are of praise <br>‘ tiske the modest elm",-0.4962962962962963,-0.6,-0.3333333333333333,-0.7333333333333333,-0.4666666666666667,-0.3333333333333333,-0.4666666666666667,-0.6,-0.7333333333333333,-0.2,-0.06666666666666667
"they sorrow , who were called<br>from her sweet smile to part ,<br>who wore her love-links fondly twined<br>like woven threads of gold refined<br>around their inmost heart .",0.3333333333333333,-0.3333333333333333,1.0,0.3333333333333333,-1.0,1.0,1.0,0.3333333333333333,1.0,-0.3333333333333333,-0.3333333333333333
"unknown, australia? surely only dreams,<br>the visions of an artist who was quote,<br>before, among the poets of his seems,<br>as one of those creative spirits which,<br>without apparent motive other, feed,<br>and prosper by their own av off pitch,<br>upon which other angels also need,<br>and even with delight. and therefore, when,<br>in his artistic efforts being then.",0.037037037037037035,0.3333333333333333,-0.3333333333333333,1.0,0.3333333333333333,0.3333333333333333,-0.3333333333333333,-1.0,-0.3333333333333333,0.3333333333333333,0.3333333333333333
"the people from behind melinda gates, <br>are causing unemployment compensation ! <br>not like awareness month united states ! <br>it needs no greater moral obligation. <br><br>or any social alcohol addiction, <br>to fill a mental health facility. <br>we only need a ten percent prescription ! <br>and criminal responsibility.",0.12418300653594772,0.17647058823529413,-0.058823529411764705,-0.5294117647058824,0.29411764705882354,0.4117647058823529,0.058823529411764705,0.6470588235294118,0.17647058823529413,-0.058823529411764705,-0.17647058823529413
"and through black wave and stormy blast ,<br>and out of the fog-wreath dense and dun ,<br>guided and held , shall the vessel run ,<br>gain the fair haven , night being past ,<br>and anchor in the sun ?",-0.14814814814814814,-0.3333333333333333,-0.16666666666666666,-0.5,0.16666666666666666,0.16666666666666666,-0.6666666666666666,0.16666666666666666,-0.5,0.3333333333333333,-0.5
"among, my other teachers, people, whom,<br>among the people, people i have scene,<br>before another picture, other room,<br>another country, other landscape, same,<br>except, however, only seeing them,<br>among, myself. perhaps because i came,<br>amongst the people only after hem,<br>among myself, perhaps, among myself,<br>amongst another picture, only self.",0.3333333333333333,0.3333333333333333,0.3333333333333333,0.3333333333333333,0.3333333333333333,-0.3333333333333333,1.0,0.3333333333333333,0.3333333333333333,0.3333333333333333,1.0
"when all is done , say not my day is o'er ,<br>and that thro ’ night i seek a dimmer shore :<br>say rather that my morn has just begun ,—<br>i greet the dawn and not a setting sun ,<br>when all is done .",0.3333333333333333,0.3333333333333333,0.3333333333333333,0.3333333333333333,0.3333333333333333,0.3333333333333333,1.0,-0.3333333333333333,1.0,-0.3333333333333333,0.3333333333333333
"the castle of our desire vultures we must be seen <br>the castle with a watery lustre you might obtain <br>and the wanderer to the castle of the mind <br>cloven of our souls, and set my foot on ground <br>with what delight the meanest wanderer could understand",-0.08641975308641975,-0.1111111111111111,-0.2222222222222222,-0.2222222222222222,0.0,0.0,-0.4444444444444444,0.1111111111111111,0.0,0.1111111111111111,-0.3333333333333333
"all winds like stars. but by a sunlight blow<br>a star of light and night, so less apart<br>i want to bow, expand the eyes to glow<br>and tremble at the bosom of my heart",0.8518518518518519,1.0,1.0,1.0,0.3333333333333333,1.0,1.0,1.0,0.3333333333333333,1.0,1.0
"the castle of our desire vultures we must be seen <br>the open ray and the worm within the cave <br>the church might be one satisfy worn with our lore <br>the castle still is dismal, an as word <br>in the end, the children are to be seen",-0.017543859649122806,-0.47368421052631576,-0.05263157894736842,0.15789473684210525,0.2631578947368421,-0.15789473684210525,0.05263157894736842,0.15789473684210525,0.05263157894736842,-0.15789473684210525,0.15789473684210525
"april in england ! and her sons are lying<br>on these red fields , and dreaming of her shore ;<br>april ! we hear the thrushes ’ songs replying<br>each unto each , above the cannons ’ roar .<br>april in england ! shall we see it more ?",0.6296296296296297,0.3333333333333333,1.0,0.3333333333333333,1.0,1.0,1.0,0.3333333333333333,0.3333333333333333,0.3333333333333333,1.0
"a tree , violet are from the leaves ,<br>fresh breath with glee brain ,<br>in all that summer day year ,<br>and we rise by the break of riding , far of an ancient judgment guard no fear ,<br>the muse it strain .<br>from answered 's so , call",-0.1111111111111111,0.2,-0.6,-0.2,0.2,-0.6,0.2,-0.2,-0.2,0.2,0.6
"the castle of our desire vultures we must be proud <br>we saw once at the inn of time our joyous thought <br>we transformed it to an hour of shame <br>and tired men mock it, with the victor's right <br>we found it in the tables, not working wrong",0.018518518518518517,0.0,0.0,-0.16666666666666666,0.0,0.3333333333333333,-0.16666666666666666,-0.16666666666666666,0.3333333333333333,0.0,-0.3333333333333333
"without delay, the other, even he,<br>the fellow, entered into battle when,<br>without surprise, upon his sudden. me,<br>and other servants, many of the same,<br>against his will, began the battle. he,<br>however valiant he appeared in fame,<br>in battle never suffered damage- ne,<br>however noble he appeared, himself,<br>without reserve, inflicted lasting shelf.",0.05555555555555555,-0.5,0.5,-1.0,0.0,0.5,0.5,0.0,-0.5,1.0,0.5
"with his philibeg an ’ tartan plaid ,<br>an ’ gude claymore down by his side ,<br>the ladies ’ hearts he did trepan ,<br>my gallant braw john highlandman .<br>sing , hey , & c .",-0.35555555555555557,-0.2,-0.2,0.2,-0.2,-0.6,-0.6,-0.4,-0.2,-1.0,-0.4
"think not they come for love of thee !<br>they seek from ennui to be free ,<br>to ask some boon , or tell some tale<br>which , true or false , will rarely fail<br>to leave behind a poisoned trail .",0.4074074074074074,1.0,0.3333333333333333,0.3333333333333333,1.0,1.0,-0.3333333333333333,-0.3333333333333333,0.3333333333333333,0.3333333333333333,0.3333333333333333
"his mother then did give jack some advice ,<br>to her son a thief , who was not o'er nice ;<br>says she — “ fight your way , jack , and stand the brunt ,<br>you 're of no use , my child , without the blunt ,[ 10 ]<br>foddy , loddy , high o . ”",0.05555555555555555,0.5,-0.5,0.0,-0.5,1.0,0.5,0.0,0.0,-0.5,0.5
"the castle of our desire vultures we must be seen <br>the castle with a watery lustre on the floor <br>and the wanderer to the steps of the stones <br>with allrespect, as he ne'er unworthy are of sight <br>this lily the hand of the poor man",-0.02564102564102564,-0.07692307692307693,0.07692307692307693,-0.38461538461538464,0.38461538461538464,-0.23076923076923078,0.07692307692307693,0.07692307692307693,-0.07692307692307693,-0.07692307692307693,-0.5384615384615384
"my darling child, to me; i have enjoyed,<br>myself enjoy the present pleasure. to,<br>myself, the future trouble, i shall void,<br>myself enjoy, and empty into air.<br>i am afraid, indeed, that you delight,<br>myself enjoy; you seem so lovely- faire,<br>without the shadow even, therefore- quite,<br>without the shadow, even, of regret.<br>indeed i cannot say enough in debt.",0.2727272727272727,0.2727272727272727,0.2727272727272727,0.6363636363636364,0.6363636363636364,0.45454545454545453,-0.09090909090909091,0.09090909090909091,-0.2727272727272727,0.45454545454545453,1.0
