poem,all,coherent,grammatical,melodious,moved,real,rhyming,readable,comprehensible,intense,liking
"i watched the men at work on the stubborn rock ,<br>but mostly the one man poised on a drill<br>above the steam that hissed and billowed about him<br>white in the frosty air ,<br>where the lordly house would stand .",0.6111111111111112,1.0,0.0,1.0,0.5,1.0,0.0,1.0,1.0,0.0,0.0
"where the soil oozes under thy feet .<br>better , ah , better to die<br>than to take one step in the mire !<br>oh , blessed to die or to live ,<br>with garments of holy fire !",0.26666666666666666,0.8,0.2,0.0,0.6,0.0,0.4,0.4,0.0,0.0,0.4
the silly wights going out his desk <br>he shifts but one as he another day <br>sun is not now ! for never to the day <br>what gentle sweetness got connubial è n view,-0.1111111111111111,-0.3333333333333333,-0.3333333333333333,0.3333333333333333,-0.3333333333333333,0.3333333333333333,-0.3333333333333333,-0.3333333333333333,-0.3333333333333333,0.3333333333333333,-0.3333333333333333
"turn then your eyes from the far track<br>of worlds , and gazing inward ,<br>o brother , fare where life has come ,<br>yea , into its far whence fare back .<br>all other ways are sinward .",0.09401709401709402,0.07692307692307693,-0.23076923076923078,0.38461538461538464,-0.07692307692307693,0.07692307692307693,0.23076923076923078,0.23076923076923078,0.07692307692307693,0.07692307692307693,-0.07692307692307693
"the castle of our desire vultures we must be seen <br>the castle with a watery lustre throughout <br>the floor is less to us than the cellar <br>if the poor or the wanton mother that we call <br>thou lifted as the heath, and unloved the sleeping",-0.5555555555555556,-1.0,-1.0,-0.3333333333333333,-0.3333333333333333,-0.3333333333333333,-0.3333333333333333,-0.3333333333333333,-0.3333333333333333,-1.0,-0.3333333333333333
"beyond the pearled horizons lie<br>winter and night : awaiting these<br>we garner this poor hour of ease ,<br>until love turn from us and die<br>beneath the drear november trees .",-0.1111111111111111,0.3333333333333333,-1.0,-0.3333333333333333,-0.3333333333333333,0.3333333333333333,-0.3333333333333333,0.3333333333333333,-0.3333333333333333,0.3333333333333333,-0.3333333333333333
"come to the hills , the woods are green —<br>the heart is high when love is sweet —<br>there is a brook that flows between<br>two mossy trees where we can meet ,<br>where we can meet and speak unseen .",-0.1111111111111111,-0.09090909090909091,-0.2727272727272727,-0.09090909090909091,-0.09090909090909091,-0.09090909090909091,-0.2727272727272727,-0.09090909090909091,0.2727272727272727,-0.2727272727272727,-0.09090909090909091
"o vieux momotombo , colosse chauve et nu ,<br>qui songes près des mers , et fais de ton cratère<br>une tiare d'ombre et de flamme à la terre ,<br>pourquoi , lorsqu'à ton seuil terrible nous frappons ,<br>ne veux-tu pas du dieu qu'on t'apporte ? réponds .",-0.25925925925925924,-1.0,0.3333333333333333,-0.3333333333333333,-1.0,-0.3333333333333333,-0.3333333333333333,0.3333333333333333,-0.3333333333333333,0.3333333333333333,0.3333333333333333
"then saw he left him and from brighter day<br>he now was such so white as from the snow<br>of the past, shall set it on his brow<br>and withered, as it hath to pass away",0.4074074074074074,1.0,0.3333333333333333,-0.3333333333333333,0.3333333333333333,0.3333333333333333,0.3333333333333333,1.0,0.3333333333333333,0.3333333333333333,1.0
"i shall not ask , i will not weep ; <br>he is not a slave , but his mother is so fair , <br>as the man on the tree <br>is a bird that comes in a dream",-0.1111111111111111,0.3333333333333333,0.3333333333333333,0.3333333333333333,-1.0,0.3333333333333333,-0.3333333333333333,-0.3333333333333333,0.3333333333333333,-1.0,0.3333333333333333
"“ might his cat be a woman , ” he said :<br>venus changed her : the couple were wed :<br>but a mouse in her sight<br>metamorphosed her quite ,<br>and for bride , a cat found he instead .",-0.037037037037037035,0.3333333333333333,-0.3333333333333333,-0.3333333333333333,0.3333333333333333,0.3333333333333333,-0.3333333333333333,-0.3333333333333333,-0.3333333333333333,0.3333333333333333,-1.0
"who summoned marvels there to meet ,<br>with pomp , upon a cloth of gold ;<br>where berries of the bittersweet ,<br>that , splitting , showed the coals they hold ,<br>sowed garnets through the wold :",0.3333333333333333,0.3333333333333333,1.0,-0.3333333333333333,1.0,-1.0,-0.3333333333333333,1.0,1.0,0.3333333333333333,0.3333333333333333
"might we call ere my brow<br>o'er many that lie thrall ;<br>ah well sovereign for thy heart festal .<br>why the lord of the world seems gold liked folly ?<br>if , some almost clock , and ghost born it things<br>tell , went the way ,<br>along the way we",-0.48148148148148145,-0.3333333333333333,-1.0,-0.3333333333333333,-0.3333333333333333,0.3333333333333333,-0.3333333333333333,-1.0,-0.3333333333333333,-1.0,-0.3333333333333333
"is with humanity; and without end<br>whatever of thy spirit shall be blest<br>he hath the need of freedom, which the land<br>which leads to him, in godliness and rest",0.17777777777777778,0.0,0.4,0.4,0.0,0.0,0.4,0.2,0.2,0.0,0.0
"standing scenes ( some in rather waste spell<br>‘ o only , thus , my soul ’ born<br>the love of earth !",-0.5555555555555556,-1.0,0.3333333333333333,0.3333333333333333,-1.0,-1.0,-0.3333333333333333,-1.0,-1.0,-0.3333333333333333,-0.3333333333333333
"and i loved , that i might ever in my bosom bear a treasure<br>strong to ransom life from sorrow , strong to furnish it with joy ;<br>so i sought with keenest insight — neither small nor scant the<br>measure<br>to content my requisition — purest gold without alloy .",0.37777777777777777,0.4,0.4,0.4,0.4,0.2,0.2,0.2,0.6,0.6,0.4
"the wind is a rose . <br>i 'll see , i 'll be still , <br>and i am weary of the day , <br>and i have been a man ,",-0.3333333333333333,0.3333333333333333,-0.3333333333333333,-0.3333333333333333,-0.3333333333333333,-0.3333333333333333,0.3333333333333333,-0.3333333333333333,-1.0,-1.0,-0.3333333333333333
"if love by prayers and ends at power . with art <br>the soul too large to death , but wretched art <br>as worm or fool , in it to god 's true heart <br>here lodging labour 'd me , to win your own",0.4074074074074074,0.3333333333333333,1.0,-1.0,-0.3333333333333333,0.3333333333333333,1.0,0.3333333333333333,1.0,1.0,0.3333333333333333
"the castle of our desire vultures we must be seen <br>the castle with a watery lustre on the floor <br>and the wanderer to the steps of splendid <br>who pass 'd to the poor and their slaves, in the blaze <br>spat at the inns and the wand",0.2962962962962963,0.0,0.3333333333333333,1.0,0.3333333333333333,0.3333333333333333,-0.3333333333333333,0.3333333333333333,0.0,0.6666666666666666,0.0
"i wanted to be better than i had.<br>because i had already been so few.<br>because the only other choice is bad.<br>because the future always closes) so,<br>i opened up another one. again.<br>again, until the pages were as though,<br>exhausted, i had opened up and when,<br>exhausted from exhaustion, nothing came,<br>because the only answer to my name.",-0.18518518518518517,-1.0,-1.0,0.3333333333333333,-0.3333333333333333,0.3333333333333333,0.3333333333333333,-0.3333333333333333,-0.3333333333333333,0.3333333333333333,-0.3333333333333333
the castle of our desire vultures we must be seen <br>the castle with a watery lustre on the floor <br>and the wanderer to the steps of the stones <br>with all her cruell wand'rer as he rides along <br>the meanest serf on sir launfal,0.1111111111111111,0.5,1.0,0.5,0.0,0.0,-1.0,-0.5,0.5,0.0,0.0
"we sacrifice to dress , till household joys<br>and comforts cease . dress drains our cellar dry ,<br>and keeps our larder lean ; puts out our fires ,<br>and introduces hunger , frost and woe ,<br>where peace and hospitality might have reign 'd .",0.37777777777777777,1.0,0.2,0.2,0.6,0.2,-0.2,-0.2,0.6,1.0,0.6
"sweet is spring , and sweet the morning , my beloved , my beloved ;<br>now for us doth spring , doth morning , wait upon the year 's increase ,<br>and my prayer goes up , “ oh , give us , crowned in youth with marriage glory ,<br>give for all our life 's dear story ,<br>give us love , and give us peace ! ”",0.2777777777777778,0.5,0.5,1.0,-0.5,1.0,0.0,1.0,-1.0,0.0,-0.5
"yes ! we confess it ! ‘ mong the sons of fate ,<br>earth 's great ones , thou art great !<br>as that tall peak which from her silver cone<br>of maiden snow unstain 'd<br>all but the bravest scares , and reigns alone",0.4074074074074074,0.3333333333333333,1.0,-0.3333333333333333,1.0,1.0,0.3333333333333333,1.0,-1.0,0.3333333333333333,1.0
"you look lots like yer mother : purty much same in size ;<br>and about the same complected ; and favor about the eyes :<br>like her , too , about livin ’ here ,— because she could n't stay :<br>it 'll ‘ most seem like you was dead — like her !— but i hai n't got<br>nothin ’ to say !",0.18518518518518517,0.3333333333333333,0.3333333333333333,-0.3333333333333333,0.3333333333333333,-0.3333333333333333,0.3333333333333333,0.3333333333333333,0.3333333333333333,0.3333333333333333,0.3333333333333333
"on the “ poems of the king , ” he said , “ in the sight of my heart , ” <br>the angel said , “ my friend , <br>“ i am not fair . ” <br>“",-0.05555555555555555,0.5,-0.5,0.5,0.5,-1.0,0.5,0.0,-0.5,-0.5,-0.5
"let misty autumn be our part !<br>the twilight of the year is sweet :<br>where shadow and the darkness meet<br>our love , a twilight of the heart<br>eludes a little time 's deceit .",0.3888888888888889,1.0,0.0,0.5,0.5,1.0,-0.5,0.5,0.5,0.0,0.5
"thou art the soul of a summer 's day ,<br>thou art the breath of the rose .<br>but the summer is fled<br>and the rose is dead<br>where are they gone , who knows , who knows ?",-0.25925925925925924,-0.3333333333333333,-0.3333333333333333,-0.3333333333333333,-0.3333333333333333,-1.0,0.3333333333333333,-0.3333333333333333,0.3333333333333333,-0.3333333333333333,1.0
"lord , from this prison-house that we have built ,<br>this dark abode of pain and misery ,<br>failure and guilt ,<br>we stretch our hands , we stretch our hands to thee ,<br>lord , set us free .",0.18518518518518517,0.3333333333333333,-1.0,0.3333333333333333,0.3333333333333333,-0.3333333333333333,-0.3333333333333333,0.3333333333333333,1.0,1.0,1.0
"in any case; and also being, you,<br>perhaps because, unlike, you are to fonts,<br>to water- chambers, water only to,<br>and water always ready, whether we,<br>the water, would enjoy or suffer, be,<br>again and now forever; being me,<br>i suffer being being being) we,<br>the bodies of the living only we,<br>the bodies living always only. b.",-0.1111111111111111,0.3333333333333333,0.3333333333333333,-0.3333333333333333,-0.3333333333333333,-1.0,-0.3333333333333333,1.0,-0.3333333333333333,-0.3333333333333333,0.3333333333333333
"and also mrs johnson had become,<br>in mrs johnson, mrs johnson used,<br>without regard, sometimes without the sum,<br>sometimes with very slight respect. she used,<br>without reserve. and always very strong,<br>without reserve. she always used her bruised,<br>expensive muscles, very lightly) long,<br>sometimes severe commands about the place.<br>and always mrs miller always face.",0.25925925925925924,0.3333333333333333,-0.3333333333333333,0.3333333333333333,0.3333333333333333,1.0,0.3333333333333333,-1.0,0.3333333333333333,1.0,-0.3333333333333333
"besides , what vexed us worse , we knew ,<br>they have no need of such as you<br>in the place where you were going :<br>this world has angels all too few ,<br>and heaven is overflowing !",-0.2777777777777778,-0.5,0.0,0.5,-0.5,-0.5,-0.5,-0.5,-0.5,0.0,0.0
"the wind that blows the way ; <br>the mountains of the sea . <br>the hills of the world 's dark night <br>from the sky to east and west ,",0.1111111111111111,0.0,-0.4,0.0,0.0,0.2,0.4,0.4,0.8,-0.4,-0.2
"what sorrow is it; ah! that i must may<br>go back to gentle love?— but that is told<br>our children yet in garlands of the day<br>take off, and left it down, and to behold",-0.1111111111111111,-0.5,0.0,-0.5,0.0,-0.5,0.0,0.0,0.5,0.0,-1.0
"i have desired , and i have been desired ;<br>but now the days are over of desire ,<br>now dust and dying embers mock my fire ;<br>where is the hire for which my life was hired ?<br>oh vanity of vanities , desire !",0.1111111111111111,-0.3333333333333333,-0.3333333333333333,-0.3333333333333333,0.3333333333333333,0.3333333333333333,-0.3333333333333333,0.3333333333333333,1.0,0.3333333333333333,0.3333333333333333
"“ fine feathers , ” jack thought , “ make fine fowls ;<br>i 'll be envied of bats & of owls : ”<br>but the peacocks ’ proud eyes<br>saw through his disguise ,<br>and jack fled the assembly of fowls .",0.25925925925925924,-0.3333333333333333,-0.3333333333333333,1.0,0.3333333333333333,0.3333333333333333,0.3333333333333333,-0.3333333333333333,0.3333333333333333,1.0,0.3333333333333333
"in thy clear eyes i descried<br>many a proof of love , to-day ;<br>but to-night , those unbelied<br>speechful eyes being gone away ,<br>there 's the proof to seek , beside .",0.1111111111111111,0.3333333333333333,0.3333333333333333,-0.3333333333333333,1.0,0.3333333333333333,0.3333333333333333,-1.0,0.3333333333333333,-0.3333333333333333,-0.3333333333333333
"it is not ever and for man's own heart<br>he falls in us upon her, what to see<br>he knows in all that honor which may be<br>and this, the type of all the fair of art",-0.037037037037037035,-0.3333333333333333,0.3333333333333333,0.3333333333333333,-0.3333333333333333,0.3333333333333333,0.3333333333333333,-0.3333333333333333,-0.3333333333333333,-0.3333333333333333,-0.3333333333333333
"the world grows stronger than the last . <br>the world is in the field of the sea ! <br>a thousand feet are singing <br>as the world is green and green ,",0.1111111111111111,0.3333333333333333,1.0,0.3333333333333333,-0.3333333333333333,0.3333333333333333,-0.3333333333333333,-0.3333333333333333,-1.0,1.0,0.3333333333333333
"long ago , the old and lonely , <br>the king and the free , <br>and the wild wind blows in the shadow of the sea , <br>a little cloud of london ,",-0.3333333333333333,1.0,1.0,-1.0,-1.0,1.0,-1.0,-1.0,-1.0,-1.0,1.0
"“ i 'm a man , ” said the owl , “ i know , <br>‘ tis but a part <br>of this great soul . as i , who fear <br>that i may see my kingdom cease",-0.4444444444444444,-1.0,-1.0,0.0,-1.0,0.0,0.0,0.0,-1.0,0.0,-1.0
"except my mother. nothing. ever, now,<br>to rival her) i was afraid to place,<br>without regard to beauty. i was( how,<br>exactly, does the human body end,<br>without the body of the spirit, which,<br>without which it is neither living friend,<br>beloved, companion any more. and bitch,<br>because, again, i wanted something more,<br>because, before her dying in my  for.",-1.0,-1.0,-1.0,-1.0,-1.0,-1.0,-1.0,-1.0,-1.0,-1.0,-1.0
"looking teeth for quite to be moment :<br>large spark and gladness do ever ,<br>as noble heat and found that long might be ;<br>nor wanton heathen waves on our sad sea .<br>what is the message of",0.3333333333333333,1.0,-1.0,-1.0,-1.0,1.0,1.0,1.0,1.0,1.0,-1.0
"despairing cries float ceaselessly toward me , day and night ,<br>the sad voice of death — the call of my nearest lover , putting forth ,<br>alarmed , uncertain ,<br>“ the sea i am quickly to sail : come tell me ,<br>come tell me where i am speeding — tell me my destination . ”",-1.0,-1.0,-1.0,-1.0,-1.0,-1.0,-1.0,-1.0,-1.0,-1.0,-1.0
"had heard her tears ,— to make her sweetness hold <br>love her , for quite of husband in her blood <br>a tomb away to clear an inner stead <br>of pride , with eyes and melted lips and thrall",1.0,1.0,1.0,1.0,1.0,1.0,1.0,1.0,1.0,1.0,1.0
"are very often wiser than we think,<br>because, among themselves they reason small,<br>and even silly matters, as they shrink,<br>from that gigantic light which reason throws,<br>and therefore know enough to suffer, though,<br>perhaps because we cannot reason those,<br>we cannot reason even our  that know,<br>and cannot read their hearts, unless indeed,<br>before the letter written to the speed.",0.5555555555555556,-1.0,1.0,1.0,1.0,-1.0,1.0,1.0,1.0,1.0,1.0
"love , verse , the sun is in the west , <br>and the sun will be ready to put on <br>the poor old man ; and so he went . <br>he was a woman , and a",0.1111111111111111,1.0,-1.0,1.0,-1.0,-1.0,1.0,1.0,1.0,-1.0,-1.0
"out of the rolling ocean , the crowd , came a drop gently to me ,<br>whispering , i love you ; before long i die :<br>i have travelled a long way , merely to look on you , to touch you :<br>for i could not die till i once looked on you ,<br>for i feared i might afterward lose you .",0.25925925925925924,0.3333333333333333,0.3333333333333333,-0.3333333333333333,0.3333333333333333,1.0,-0.3333333333333333,0.3333333333333333,-0.3333333333333333,1.0,-1.0
"higher , higher , gathering light ,<br>veiling with a golden gauze<br>all the trembling atmosphere ,<br>see , the rayless disk grows white !<br>hark , the glittering billows pause !",-0.1111111111111111,-1.0,1.0,0.0,0.0,0.0,-1.0,-1.0,1.0,0.0,-1.0
"too soon you went — we miss the cheer ,<br>the kindliness vouchsafed to all ;<br>the world seems strangely lone and drear<br>when one whom many hearts hold dear<br>fares heavenward ere the shadows fall .",0.4444444444444444,1.0,0.0,0.0,0.0,1.0,1.0,0.0,1.0,0.0,0.0
"little lady icicle is laughing in the north-land ,<br>and quaffing in the north-land her wines that overflow ;<br>all the lakes and rivers crusting<br>that her finger-tips are dusting ,<br>where little lady icicle is laughing in the snow .",-0.5555555555555556,-1.0,-1.0,1.0,-1.0,1.0,-1.0,-1.0,-1.0,-1.0,1.0
"“ and now a flower is just a flower ;<br>man , bird , beast are but beast , bird , man<br>simply themselves , uncinct by dower<br>of dyes which , when life 's day began ,<br>round each in glory ran . ”",0.1111111111111111,0.0,0.0,0.0,1.0,0.0,0.0,1.0,-1.0,0.0,0.0
"i see all love in lowly things ,<br>no less than in the lusts of kings :<br>all beauty , shape and comeliness ,<br>all valour , strength and gentleness ,<br>all genius , wit and holiness .",-0.1111111111111111,1.0,-1.0,-1.0,1.0,1.0,1.0,-1.0,-1.0,-1.0,1.0
"come you , my careful flock , forego you master ,<br>i 'll fold you up and after fall a-sighing ;<br>words have no worth my secret wounds to plaster ;<br>naught may refresh my joys but phillis nighing .<br>farewell , old demades .",0.1111111111111111,-1.0,1.0,-1.0,1.0,-1.0,1.0,1.0,-1.0,1.0,1.0
"to see some very little brighter tone ! <br>my name was never even morgan fisher. <br>but then my only human baritone, <br>has taken something from an old beginner. <br><br>another crazy alto saxophone ! <br>is there too many people being played, <br>or blinded by dynamic microphone ! <br>this feeling like a heavy metal blade.",0.5555555555555556,1.0,1.0,1.0,-1.0,1.0,-1.0,1.0,1.0,1.0,1.0
"the song cried ever in the sheets of life <br>and when beneath him bars him o'er the moon <br>here in his breath he laid himself to be <br>a man i call him life , his early growth",-0.7777777777777778,-1.0,-1.0,-1.0,-1.0,-1.0,-1.0,-1.0,1.0,-1.0,-1.0
"has not , since then , love 's prompture deep ,<br>has not love 's whisper evermore<br>been ceaseless , as thy gentle roar ?<br>sole voice , when other voices sleep ,<br>dear under-song in clamor 's hour .",-0.5555555555555556,-1.0,-1.0,-1.0,-1.0,-1.0,-1.0,-1.0,1.0,1.0,-1.0
"i knew your pain , and it broke<br>my fine , craftsman 's nerve ;<br>your body quailed at my stroke ,<br>and my courage failed to give you the last<br>fine torture you did deserve .",-0.5555555555555556,-1.0,-1.0,-1.0,-1.0,1.0,-1.0,-1.0,-1.0,1.0,-1.0
"come in my wealth , and poor — and furious woes <br>the left , and sooth 'd them to the chin his fire <br>god led me with the wonder of ulysses , choked <br>i think of what , o lord , for those which hear",-0.3333333333333333,-1.0,-1.0,1.0,-1.0,1.0,1.0,-1.0,-1.0,-1.0,-1.0
"my father , if i might be a king , <br>if aught of that loved and fame , <br>i might have been but the deed of life to come ; <br>and the strength of the banner in",0.1111111111111111,1.0,1.0,-1.0,1.0,-1.0,-1.0,1.0,-1.0,1.0,-1.0
"she swaying a fly in victory ,<br>she , the woodland earth is blossoms<br>they passed will , then , were captive dusk ,<br>all the them in their beneath one blast to the water in his clear<br>that nobler thro : ‘ stir<br>thou earnest , mean",-0.1111111111111111,-1.0,-1.0,1.0,-1.0,1.0,1.0,-1.0,1.0,-1.0,1.0
"there is no wind to stir the leaves ,<br>the harsh leaves overhead ;<br>only the querulous cricket grieves ,<br>and shrilling locust weaves<br>a song of summer dead .",-0.1111111111111111,1.0,-1.0,-1.0,-1.0,-1.0,1.0,1.0,-1.0,1.0,1.0
"the magick gan , to all his flight hovers <br>but heav'n of them were lost and blend <br>with that not fickle , nor burnt , nor father 's brows <br>to see , with slowly sometimes cursed and lights",-0.5555555555555556,1.0,-1.0,-1.0,-1.0,-1.0,-1.0,-1.0,-1.0,1.0,-1.0
"not ev'ry; but so much as he will say<br>was always as it was upon my breast<br>and to this day, shall put his crown on last<br>if he had changed his summer, grown away",-0.1111111111111111,1.0,1.0,-1.0,1.0,-1.0,-1.0,1.0,-1.0,-1.0,-1.0
"but still the children of those exiled moors ,<br>a sad transplanted stem on alien shore ,<br>keep as their trust — and will while time endures —<br>the rusty keys which their forefathers bore ;<br>the keys of those shut doors which ne ’ er shall open more .",0.1111111111111111,-1.0,-1.0,1.0,-1.0,1.0,1.0,-1.0,1.0,1.0,1.0
"who for his dog had got the old man's john<br>that he has left us for the gown he true<br>has past to follow, here my way to run<br>and calls upon him, and will let him go",0.1111111111111111,1.0,-1.0,1.0,1.0,-1.0,1.0,1.0,-1.0,-1.0,1.0
"not even going over aaron carter ! <br>that crazy super funky old roulette ! <br>so mister mister mrs. tupac shakur, <br>this little party at my private jet. <br><br>some people wanna sing the latest lingo ! <br>too many people starring jennifer ! <br>they need another music video, <br>or maybe something like a fortune teller.",-0.4444444444444444,0.0,0.0,-1.0,-1.0,0.0,0.0,-1.0,-1.0,0.0,0.0
"yet whoso thinks he moves himself his best<br>is to her lord: she is a child of all<br>and all the life she run, and sinks to fall<br>at last, he left her with him for the rest",-0.1111111111111111,-1.0,1.0,1.0,1.0,-1.0,-1.0,-1.0,1.0,-1.0,1.0
"of flowers, flowers, roses. flowers are,<br>indeed. i wonder what he is on room,<br>on sofa? is that fellow sleeping far,<br>or eating something other than dessert?<br>perhaps, beneath the evening skies of ice,<br>he watches us. perhaps the evening( pert,<br>impatient) evening star( perhaps the nice,<br>delicious evening star, perhaps, perhaps,<br>the pleasant evening star perhaps. he taps.",0.5555555555555556,1.0,-1.0,1.0,1.0,1.0,1.0,1.0,1.0,-1.0,-1.0
"do n't desire the churchyard friends ?<br>here i am destruction ;<br>my love breath and face for the truth if truth cheered the dead ;<br>and when go softly gently , and it disdain ,<br>as she early comes me in — then the loyal the",0.1111111111111111,-1.0,1.0,-1.0,-1.0,1.0,-1.0,1.0,1.0,1.0,-1.0
"if , should record certainly , the loveliest soul<br>all sweet in god 's best phantom ;<br>memories and woe , as hate<br>wild despair had fix ;<br>in hate of flitting turns ,<br>thrill to the wild with your",0.0,0.0,0.0,1.0,1.0,0.0,0.0,-1.0,0.0,-1.0,1.0
"their tender neon stars are burning bright. <br>she sits and though it only catches thunder, <br>or when his love is nearly outta sight ! <br>her hair has never gotten any rougher. <br><br>no other woman needs another flare, <br>that bothers me so you can hardly bide ! <br>the very pretty little crimson glare ! <br>extremely easily identified.",-0.3333333333333333,-1.0,1.0,-1.0,1.0,-1.0,-1.0,-1.0,1.0,-1.0,-1.0
"we think not what it is; so still i pray<br>i hear and ask that for it will to be<br>never is willing to be strong and free<br>so, as we will, when all the past was day",0.3333333333333333,1.0,1.0,1.0,1.0,-1.0,1.0,-1.0,-1.0,1.0,1.0
"before, before, behind, before and, well,<br>behind before, before, behind. and' dis,<br>before the coming into any hell,<br>before the going into any hell,<br>before, behind and after dis before,<br>before, above and falling under- well,<br>above, below, before before and for,<br>behind and falling after, falling, well,<br>behind and after falling. well. the. hell.",0.1111111111111111,1.0,-1.0,1.0,1.0,-1.0,-1.0,-1.0,1.0,1.0,-1.0
"the castle of our desire vultures we found <br>weigh we [ a bower not full many a fold <br>the corse, the gipoyson, and the ponderous heave <br>we bring it,— the castle of anuplus <br>the castle with a clock",0.1111111111111111,-1.0,-1.0,1.0,1.0,1.0,-1.0,1.0,1.0,-1.0,-1.0
"[ exulted ] mean 3 come wheat old nook went ,<br>and there 's glory panting o'er the sky ;<br>god help us a mother money wondrous life .<br>in dreams earth i saw the sun<br>whose spirit makes the angry child<br>along won all her little while .<br>“ you",-0.3333333333333333,-1.0,-1.0,1.0,-1.0,-1.0,-1.0,1.0,-1.0,1.0,-1.0
"the clocks are chiming in my heart<br>their cobweb chime ;<br>old murmurings of days that die ,<br>the sob of things a-drifting by .<br>the clocks are chiming in my heart !",-0.5555555555555556,-1.0,-1.0,-1.0,-1.0,1.0,-1.0,1.0,-1.0,-1.0,-1.0
"my blades , before my chaunt i end ,[ 14 ]<br>here the rag-sauce of a friend ;[ 15 ]<br>ne'er trust to any fancy jade ,<br>for all their chaff is only trade !<br>fol , de , rol .",-0.5555555555555556,-1.0,1.0,-1.0,-1.0,-1.0,1.0,-1.0,-1.0,-1.0,-1.0
"from the earth that waits for thee , <br>and the best of all the good . <br>but still they still are gone , <br>while the voices that runs ever met",-0.1111111111111111,1.0,-1.0,1.0,-1.0,-1.0,-1.0,1.0,1.0,-1.0,-1.0
