poem,all,coherent,grammatical,melodious,moved,real,rhyming,readable,comprehensible,intense,liking
"but , each being ready to talk , i suppose ,<br>order ! order !<br>they cried , for the chair !<br>and , much to their wonder , our friend arose<br>and fastened his eye on the eye of the mayor .",0.48148148148148145,1.0,1.0,0.3333333333333333,-0.3333333333333333,1.0,-0.3333333333333333,0.3333333333333333,0.3333333333333333,1.0,-0.3333333333333333
"the castle of our desire vultures we must be proud <br>we saw once at the inns of time <br>the hangiest and the meanest trillium we could not seen <br>the verily of a tower, the midnight grass <br>the lily, the aisles stretch of",-0.4074074074074074,0.3333333333333333,-1.0,-0.3333333333333333,-0.3333333333333333,-1.0,-0.3333333333333333,0.3333333333333333,-1.0,-0.3333333333333333,-1.0
"an ocean full of virtual machines, <br>we know that there is nothing really stable ! <br>i never mention those enormous genes ! <br>not even having any other nasal. <br><br>these very little silver mountain root, <br>for flying children making high formation ! <br>whose hands are swinging on an alto flute ! <br>a thousand planets under concentration.",0.25925925925925924,1.0,-0.3333333333333333,0.3333333333333333,-1.0,1.0,0.3333333333333333,-0.3333333333333333,1.0,0.3333333333333333,1.0
the sun shall shine the sky — <br>the sun is new ! <br>the world is far too wide to understand <br>the very day that i had loved so long,0.037037037037037035,0.3333333333333333,-0.3333333333333333,0.3333333333333333,-0.3333333333333333,-0.3333333333333333,0.3333333333333333,0.3333333333333333,-0.3333333333333333,0.3333333333333333,0.3333333333333333
"and thus his counsel for this spark i call <br>and home in rage from prison deeds to flatter <br>for some , with fix 'd regard the prince prepares <br>the strange , as did not shed apart",0.1111111111111111,-0.3333333333333333,0.3333333333333333,0.3333333333333333,-0.3333333333333333,0.3333333333333333,-0.3333333333333333,0.3333333333333333,0.3333333333333333,0.3333333333333333,0.3333333333333333
"first published by the mouth ,<br>on a prize living fast<br>that stone with sweeter wind thanks the sea ,<br>‘ how should the wondrous pine died too so so<br>that you home again ! i have",0.48148148148148145,0.3333333333333333,1.0,1.0,0.3333333333333333,-0.3333333333333333,1.0,1.0,1.0,-1.0,0.3333333333333333
"ah me ! for the land that is sown<br>with the harvest of despair !<br>where the burning cinders , blown<br>from the lips of the overthrown<br>enceladus , fill the air .",0.1111111111111111,-0.3333333333333333,-0.3333333333333333,1.0,0.3333333333333333,-0.3333333333333333,0.3333333333333333,0.3333333333333333,-0.3333333333333333,0.3333333333333333,0.3333333333333333
"indeed. the others are the trouble, they,<br>because of having given trouble to,<br>the many, who themselves are troubled day,<br>and evening, by their many children. they,<br>moreover, are the trouble, for besides,<br>the very many children they have slay,<br>because they wander after having rides,<br>and coming into certain places. they,<br>besides that many suffer pain from grey.",0.2,0.2,0.6,0.0,0.4,0.8,-0.2,0.4,0.2,-0.6,0.6
"oh , that languishing yawn !<br>oh , those eloquent eyes !<br>i was drunk with the dawn<br>of a splendid surmise surmise —<br>i was stung by a look , i was slain by a tear , by a tempest of sighs .",0.18518518518518517,0.3333333333333333,0.3333333333333333,-0.3333333333333333,0.3333333333333333,0.3333333333333333,1.0,-0.3333333333333333,0.3333333333333333,-0.3333333333333333,0.3333333333333333
"or dancing at a summer matinee. <br>and from an early evening invitation, <br>that very lovely little music play ! <br>this letter gives my number one ovation. <br><br>no need for me to wait until november ! <br>i never wanna see another scene, <br>where it ever happened by september ! <br>the world is such an awful dance routine.",0.2777777777777778,0.5,0.5,-0.5,-0.5,0.5,1.0,0.5,0.5,0.0,-0.5
"for moonlight of silver and sunlight of gold<br>glint the orchards of lemons and mangoes ,<br>and the ladies , we 're told ,<br>are a joy to behold<br>as they twine in their lissome fandangoes .",0.07692307692307693,0.23076923076923078,0.07692307692307693,-0.07692307692307693,-0.07692307692307693,0.5384615384615384,-0.07692307692307693,0.38461538461538464,0.07692307692307693,-0.38461538461538464,-0.07692307692307693
"i heard a vesper-sparrow sing ,<br>withdrawn , it seemed , into the far<br>slow sunset 's tranquil cinnabar ;<br>the crimson , softly smoldering<br>behind the trees , with its one star .",0.044444444444444446,0.2,-0.2,-0.4,0.2,0.0,0.0,-0.6,0.8,0.4,0.0
"without delay or wonder was aware,<br>that something very strange was taking be,<br>indeed he had been watching her with care,<br>and wondered greatly, whether it was not,<br>perhaps it had already taken place,<br>and even questioned his beloved and caught,<br>but she remained composed and silent face,<br>and only answered, that she only knew,<br>and trusted very dearly that she do.",0.5555555555555556,0.3333333333333333,1.0,1.0,1.0,0.3333333333333333,0.3333333333333333,-0.3333333333333333,0.3333333333333333,1.0,0.3333333333333333
"in death we all are equal , great and small<br>brought to the common level of the dust ;<br>there is no glory that survives the years ,<br>nay , nay , alike we shall be as we must ;<br>sleep and forget .",0.6296296296296297,1.0,0.3333333333333333,1.0,1.0,0.3333333333333333,0.3333333333333333,0.3333333333333333,0.3333333333333333,1.0,-0.3333333333333333
"for never the north in the low tune<br>pass yet a rest for heaven smile ;<br>and cheek do him all , and tell them say ,<br>and always he is and the children 's father .<br>he nottingham the bloom of those broad seas ,<br>unto one joy is",0.4074074074074074,1.0,0.3333333333333333,-0.3333333333333333,0.3333333333333333,1.0,1.0,0.3333333333333333,-0.3333333333333333,0.3333333333333333,0.3333333333333333
"i walked a home , and i <br>watch the great river 's tide , <br>and the clouds are scattered clear , <br>the branches of the mountain 's breast ,",0.3888888888888889,0.0,0.5,0.5,0.5,0.5,0.0,0.0,0.5,1.0,1.0
"the castle of our desire vultures we should defend <br>and blot the modest el vines with fraternal rage <br>causing our poor hearts with loud prayer and fine <br>now the poor, in watery lustre daine <br>and the poor india, shicke by a waste of",-0.4,-0.4,0.0,-0.6,-0.6,-0.6,0.0,-0.6,-0.4,-0.4,-0.6
"and so divine, disposed as it so still<br>it is not punishment with his apart<br>such is my self, the patron of your will<br>and to attest me— worthy of the art",0.6296296296296297,0.3333333333333333,1.0,0.3333333333333333,0.3333333333333333,0.3333333333333333,1.0,1.0,0.3333333333333333,1.0,1.0
"sometimes wind and sometimes rain ,<br>then the sun comes back again ;<br>sometimes rain and sometimes snow ,<br>goodness , how we 'd like to know<br>why the weather alters so .",0.2222222222222222,0.5,0.5,0.5,0.0,0.0,0.0,0.0,0.5,0.0,0.0
"pity for such as peace his answer then <br>that more but mutual vengeance may invoke <br>feel these , but if thou shouldst great errors find <br>which , looking out imploring to the thief",-0.1919191919191919,-0.6363636363636364,-0.2727272727272727,-0.09090909090909091,-0.09090909090909091,-0.2727272727272727,-0.2727272727272727,0.09090909090909091,-0.09090909090909091,-0.09090909090909091,-0.2727272727272727
"we ever wanna even hula hoops ! <br>i gotta super human folding blade, <br>so busy running through electric loops ! <br>not working at my own consumer grade. <br><br>this very little giant dynamo. <br>or maybe love is never really real, <br>but yet it only likes to move too slow ! <br>an old piano on the daisy wheel.",0.5555555555555556,0.3333333333333333,0.3333333333333333,0.3333333333333333,1.0,0.3333333333333333,0.3333333333333333,0.3333333333333333,1.0,1.0,1.0
"i am ojistoh , i am she , the wife<br>of him whose name breathes bravery and life<br>and courage to the tribe that calls him chief .<br>i am ojistoh , his white star , and he<br>is land , and lake , and sky — and soul to me .",0.4074074074074074,-1.0,0.3333333333333333,1.0,0.3333333333333333,0.3333333333333333,0.3333333333333333,1.0,0.3333333333333333,1.0,1.0
"i shall not see thee , love , love , and be not love ! <br>and if she does not die for you ! <br>i look at the right with the same , <br>to be a sort",0.4074074074074074,1.0,0.3333333333333333,0.3333333333333333,0.3333333333333333,-0.3333333333333333,0.3333333333333333,1.0,0.3333333333333333,0.3333333333333333,1.0
"then , why art thou here , my bird ,<br>away from thy young , helpless brood ?<br>“ to pay thee with a song ,<br>just to let me pass along ,<br>nor harm me , as i look for their food ! ”",0.037037037037037035,1.0,-0.3333333333333333,-1.0,-0.3333333333333333,0.3333333333333333,0.3333333333333333,-0.3333333333333333,1.0,-0.3333333333333333,-0.3333333333333333
"the wind and the moon was a dream of the air ! <br>a thousand years have gone away <br>in the weary of the sea ? <br>the sound of the sun and the dew ,",0.037037037037037035,-1.0,0.3333333333333333,1.0,1.0,-0.3333333333333333,-0.3333333333333333,0.3333333333333333,-0.3333333333333333,-0.3333333333333333,-1.0
"but pure and glistening sand<br>border the placid wave ;<br>he leaves the dangerous land ,<br>to find a treacherous grave :<br>it was deep , you 'll understand .",0.044444444444444446,0.4,-0.2,-0.6,-0.4,0.6,0.0,0.4,0.0,0.2,0.6
"the castle of our desire vultures dozed <br>a pleasing chrysalis, far envuiled of snow <br>under the sky it did containe to our desire <br>we, all of it, an heire, infinite joying <br>the modest elia withered to the colde",-0.07407407407407407,0.0,-0.5,0.3333333333333333,-0.16666666666666666,-0.16666666666666666,0.16666666666666666,-0.16666666666666666,0.16666666666666666,-0.3333333333333333,-0.5
"‘ tis well i know that i am young ; <br>i have lived in a little while , <br>and i think , ‘ tis not . ’ <br>‘ it is not for the right . sat and",-0.037037037037037035,-0.3333333333333333,0.3333333333333333,-0.3333333333333333,0.3333333333333333,-0.3333333333333333,-0.3333333333333333,-0.3333333333333333,0.3333333333333333,0.3333333333333333,0.3333333333333333
"if i could only stay <br>with your eyes , with a brief embrace , <br>the look of her eyes . <br>no man knows the fair and free ,",-0.05555555555555555,0.5,0.5,0.5,-0.5,0.0,0.0,0.0,-0.5,-1.0,0.0
"but inland from the seaward spaces ,<br>none knows , not even you , the places<br>brimmed , at your coming , out of sight ,<br>— the little solitudes of delight<br>this tide constrains in dim embraces .",0.06666666666666667,-0.2,0.4,-0.2,0.2,-0.2,0.2,0.0,0.4,0.0,0.6
"at him the sun made throne away ;<br>the ages , the fatal man thro ’ unknown ,<br>was fun times , she could not ,<br>then she kneeled in him cries from mrs. ;<br>the fancy of it 5<br>the face that tribe",-0.3333333333333333,1.0,-1.0,-0.3333333333333333,-0.3333333333333333,-0.3333333333333333,-1.0,-1.0,-0.3333333333333333,0.3333333333333333,-1.0
"nor can we find all much as i must say<br>yet was the woman such as he was fast<br>and she to know that, he might try his way<br>and she most blest, all ev'ry thing to rest",0.4074074074074074,0.3333333333333333,0.3333333333333333,-0.3333333333333333,0.3333333333333333,1.0,0.3333333333333333,0.3333333333333333,1.0,0.3333333333333333,0.3333333333333333
"“ bystanders reason , think of wives<br>and children ere they risk their lives .<br>over the balustrade has bounced<br>a mere instinctive dog , and pounced<br>plumb on the prize . ‘ how well he dives !",0.4074074074074074,0.3333333333333333,-0.3333333333333333,0.3333333333333333,1.0,1.0,0.3333333333333333,-0.3333333333333333,1.0,0.3333333333333333,0.3333333333333333
"“ yet let him keep the rest —<br>but keep them with repining restlessness :<br>let him be rich and weary , that , at least ,<br>if goodness lead him not , yet weariness<br>may toss him to my breast . ”",0.18518518518518517,0.3333333333333333,-0.3333333333333333,1.0,0.3333333333333333,-0.3333333333333333,0.3333333333333333,-0.3333333333333333,0.3333333333333333,0.3333333333333333,1.0
"“ now , a pool stream a sound is led , the sun <br>the child 's broad hollow then a phantom feels <br>beneath me rack the barrier day <br>charm , from whence we 'd keep or slake my will",0.18518518518518517,0.3333333333333333,0.3333333333333333,1.0,0.3333333333333333,-1.0,0.3333333333333333,0.3333333333333333,0.3333333333333333,-0.3333333333333333,-0.3333333333333333
"the castle of our desire vultures we should shun <br>and dark elb in the open field <br>by worshippers of dim and tranquil deep <br>the garl and the stones of mroud lindenus, who wove <br>now tsil lattuled, and yet a stone",-0.15555555555555556,-0.4,0.2,-1.0,0.0,0.6,-0.2,-0.2,-0.4,0.0,-0.2
"the sunny showers , the dappled sky ,<br>the little birds that warble high ,<br>their vernal loves commencing ,<br>will better welcome you than i<br>with their sweet influencing .",0.13131313131313133,-0.45454545454545453,0.09090909090909091,-0.09090909090909091,0.45454545454545453,0.09090909090909091,0.09090909090909091,0.45454545454545453,0.45454545454545453,0.09090909090909091,0.2727272727272727
"beginner poets ( living po maintained,<br>revised editions, modern school of sprung,<br>and modern school of golden ages gained,<br>and other poems published under this,<br>the author only second line, the first,<br>however, having only first and bis,<br>and other poet- readers second burst,<br>and many second classes, many, which,<br>without exception cannot hope to pitch.",-0.3888888888888889,0.0,-0.5,-0.5,-1.0,-0.5,0.0,-1.0,-0.5,0.5,-0.5
"but he , older and wiser , stronger and sadder of heart ,<br>remembers still the cruel winter , and knows<br>that in some months that death will come again ;<br>and , for a season , lonelily meditates<br>above his lighter companions ’ frivolity .",-0.18518518518518517,-0.3333333333333333,-0.6666666666666666,0.0,-0.16666666666666666,0.0,0.0,-0.16666666666666666,-0.3333333333333333,0.0,0.0
"it of the self which is beginning all<br>that death is with and dwell at last in hell<br>that i no love of sin for it may blame<br>thy life, and for my spirit, in thy name",0.1111111111111111,0.3333333333333333,1.0,-0.3333333333333333,0.3333333333333333,-0.3333333333333333,-0.3333333333333333,0.3333333333333333,0.3333333333333333,-0.3333333333333333,-0.3333333333333333
"exactly like another person said. <br>i wanna know what happened there despite ! <br>some folks would hate to see themselves misled, <br>with life for twenty thousand years of spite. <br><br>but when the stars were taking over those ! <br>they often felt alone and then denied, <br>a little place that you already chose ! <br>an empty room was barely occupied.",0.2222222222222222,1.0,0.5,0.5,0.0,0.0,0.0,0.5,0.0,-0.5,0.0
"then i hearkened , oh ! so early , my beloved , my beloved ,<br>to that murmur from the woodland of the dove , my dear , the dove ;<br>when the nightingale came after , “ give us fame to sweeten duty ! ”<br>when the wren sang , “ give us beauty ! ”<br>she made answer , “ give us love ! ”",0.23232323232323232,0.09090909090909091,-0.2727272727272727,0.45454545454545453,-0.09090909090909091,0.09090909090909091,0.09090909090909091,0.09090909090909091,1.0,0.6363636363636364,0.09090909090909091
"she is the woman who will carry us,<br>because she is so little; therefore nice,<br>although perhaps she will be very- thus,<br>because of her. the woman with her face,<br>because it is so pretty. therefore, nice,<br>although she cannot really do that place,<br>although she would perhaps be rather) vice,<br>because perhaps. the woman who has been,<br>and will be eaten, therefore very thin.",-0.1111111111111111,-0.3333333333333333,-0.3333333333333333,-0.3333333333333333,0.3333333333333333,-0.3333333333333333,1.0,0.3333333333333333,-1.0,-0.3333333333333333,0.3333333333333333
"sitting some day in a deeper mist ,<br>silent , alone , some other day ,<br>an unknown bark from an unknown bay ,<br>by unknown waters lapped and kissed ,<br>shall near me through the spray .",0.6296296296296297,1.0,0.3333333333333333,-0.3333333333333333,1.0,1.0,1.0,0.3333333333333333,0.3333333333333333,1.0,1.0
"for private public graduation rates. <br>my very own entire gates foundation, <br>who try to hide behind melinda gates ! <br>an age of unemployment compensation. <br><br>and only one direct democracy ! <br>so many other people from protecting ! <br>the most environmental quality, <br>or simply any human beings sharing.",0.14814814814814814,0.5,0.0,0.3333333333333333,0.3333333333333333,-0.3333333333333333,0.0,0.5,0.0,0.0,0.16666666666666666
"so busy doing something very clever ! <br>i know their social thoughts become obscure. <br>with such a sympathetic character, <br>who needs another name to reassure. <br><br>they follow me around without explaining, <br>not asking any questions after teasing ! <br>but there is nothing wrong or even faking ! <br>what happens when the truth remains misleading.",-0.18518518518518517,-1.0,0.3333333333333333,-1.0,0.3333333333333333,-0.3333333333333333,-0.3333333333333333,-0.3333333333333333,0.3333333333333333,0.3333333333333333,-0.3333333333333333
"long as a night , the clouds which bear their horn <br>once seem 'd for all the voices and their king <br>and wish how silent , they prepare their pow'rs <br>one of itself from life nodding a sea",-0.25925925925925924,-1.0,-0.3333333333333333,-0.3333333333333333,-0.3333333333333333,-0.3333333333333333,-0.3333333333333333,-0.3333333333333333,0.3333333333333333,0.3333333333333333,0.3333333333333333
"i would not be a child , i will not be <br>the crown of a barren day , <br>the wild wind of the summer night , <br>but the little leaves are broken ,",0.0,0.0,0.0,0.0,-0.2,0.4,-0.2,0.6,-0.6,0.0,-0.2
"who really care about humility, <br>not gonna mention those almighty god ! <br>we know they wanna marry you sincerely. <br>but even though his name is tony todd. <br><br>and yet he gives no earthly hesitation, <br>the way that thou forever meditate ! <br>i hear a prayer for thine divine salvation, <br>to worship at an open wicket gate.",0.6111111111111112,0.5,1.0,0.5,1.0,0.5,0.5,1.0,0.5,0.0,0.5
"a storm was all; for she to him do wrong<br>what nature would we on his short delay<br>with daring, from my path he takes the way<br>and to the tent and fancy, talks of song",0.18518518518518517,0.3333333333333333,-0.3333333333333333,0.3333333333333333,-0.3333333333333333,0.3333333333333333,-0.3333333333333333,0.3333333333333333,0.3333333333333333,1.0,0.3333333333333333
"you were always a dreamer , rose — red rose ,<br>as you swung on your perfumed spray ,<br>swinging , and all the world was true ,<br>swaying , what did it trouble you ?<br>a rose will fade in a day .",0.5555555555555556,1.0,0.3333333333333333,0.3333333333333333,1.0,-0.3333333333333333,1.0,0.3333333333333333,0.3333333333333333,1.0,0.3333333333333333
"dare wear the fight and crannies from the world <br>worn , forms , and nature beauties thus embrac 'd <br>but thro ’ the war , thy sacred feast at last <br>from sire to charm , and learning still he ring 'd",-0.037037037037037035,0.3333333333333333,-0.3333333333333333,-0.3333333333333333,-0.3333333333333333,0.3333333333333333,0.3333333333333333,-0.3333333333333333,-0.3333333333333333,0.3333333333333333,-0.3333333333333333
"against his holy temple- temple- wall,<br>and there against his holy altar sod,<br>and in his holy service, even all,<br>the sacred service, even all, that he,<br>the mighty father of creation made,<br>and fashioned out in heaven; yea by me,<br>against the holy angels of his aid,<br>against their holy army that resist,<br>against the army of redeemed and missed.",0.48148148148148145,0.3333333333333333,0.3333333333333333,0.3333333333333333,1.0,1.0,0.3333333333333333,1.0,0.3333333333333333,-0.3333333333333333,0.3333333333333333
"and those who were good shall be happy : they shall sit in a golden<br>chair ;<br>they shall splash at a ten-league canvas with brushes of comet 's hair ;<br>they shall find real saints to draw from — magdalene , peter , and paul ;<br>they shall work for an age at a sitting and never be tired at all !",0.18518518518518517,0.3333333333333333,0.3333333333333333,-0.3333333333333333,0.3333333333333333,0.3333333333333333,1.0,-1.0,0.3333333333333333,0.3333333333333333,-0.3333333333333333
"it was as if an earthquake rent<br>the hearth-stones of a continent ,<br>and made forlorn<br>the households born<br>of peace on earth , good-will to men !",0.24444444444444444,-0.2,0.4,0.0,0.2,0.4,0.6,0.2,0.0,0.6,0.2
"thrice need his dream , in ev'ry plan , still stain 'd <br>to the delighted powers , and marshal all <br>nor foes provoke the virtue bound to state <br>and rank goats , with earthly charge inspir 'd",-0.5555555555555556,0.0,-1.0,-0.5,0.0,-0.5,-0.5,-1.0,-1.0,-0.5,0.0
"the first time that peter deniéd his lord<br>he had neither the throne , nor the keys nor the sword —<br>a poor silly fisherman , what could he do<br>when the cock crew — when the cock crew —<br>but weep for his wickedness when the cock crew ?",0.15555555555555556,0.6,0.4,0.0,0.4,-0.2,0.2,0.0,0.2,-0.2,-0.2
"my love that , through thy feet in beauty shown <br>but i , so do i sinking on the sky <br>drops then teach it too much a nobler foe <br>for not a faultless summer on thy throat",-0.25925925925925924,-0.3333333333333333,-0.3333333333333333,0.3333333333333333,-0.3333333333333333,-1.0,-0.3333333333333333,-0.3333333333333333,-0.3333333333333333,0.3333333333333333,0.3333333333333333
"the castle of our desire vultures we must be <br>said he, and the halls of troy <br>he goes to the poor man's wish, and gives to the hall <br>the castle, soon asunder the breeze <br>the storme will bring him, who the fernill",0.047619047619047616,0.14285714285714285,0.42857142857142855,0.14285714285714285,0.14285714285714285,0.0,-0.14285714285714285,0.14285714285714285,-0.2857142857142857,-0.14285714285714285,0.14285714285714285
"‘ tis not the lover 's fate , <br>when nature cannot be , <br>that we may be ; <br>we will not let it go ,",-0.3333333333333333,-0.3333333333333333,-0.3333333333333333,-0.3333333333333333,0.3333333333333333,0.3333333333333333,-0.3333333333333333,-1.0,-0.3333333333333333,-1.0,-1.0
"or the sidonian , with their fragrant freight<br>oil-olive , fig , and date ;<br>jars of dark sunburnt wine , flax-woven robes ,<br>or tyrian azure glass<br>wavy with gold , and agate-banded globes :—",-0.3333333333333333,-0.3333333333333333,-1.0,-0.3333333333333333,-1.0,-1.0,0.3333333333333333,-0.3333333333333333,0.3333333333333333,0.3333333333333333,-1.0
"though dim as yet in tint and line ,<br>we trace thy picture 's wise design ,<br>and thank thee that our age supplies<br>its dark relief of sacrifice .<br>thy will be done !",0.25925925925925924,-1.0,1.0,0.3333333333333333,0.3333333333333333,-0.3333333333333333,0.3333333333333333,0.3333333333333333,1.0,0.3333333333333333,1.0
"no laurels from my vanquish 'd heart shall wave<br>round your triumphant beauty as you go ,<br>not thus adorn 'd work out some other 's woe —<br>yet , if you will , pluck daisies from my grave !<br>peace ! let me go .",-0.2777777777777778,-1.0,-0.5,-0.5,-1.0,0.0,0.0,0.5,0.0,0.0,0.0
"witch , do you love accursèd hearts ?<br>say , do you know the reprobate ?<br>know you remorse , whose venomed darts<br>make souls the targets for their hate ?<br>witch , do you know accursèd hearts ?",-0.1111111111111111,-0.3333333333333333,-0.3333333333333333,0.3333333333333333,-0.3333333333333333,-0.3333333333333333,0.3333333333333333,0.3333333333333333,0.3333333333333333,-1.0,0.3333333333333333
"there is a house with ivied walls ,<br>and mullioned windows worn and old ,<br>and the long dwellers in those halls<br>have souls that know but sordid calls ,<br>and daily dote on gold .",0.2222222222222222,0.3333333333333333,0.3333333333333333,0.3333333333333333,0.5,0.3333333333333333,0.0,-0.16666666666666666,0.3333333333333333,0.0,0.0
"that nightee teem he come chop , chop ,<br>one young man walkee , no can stop ,<br>colo makee ; icee makee ;<br>he got flag ; chop b'long welly culio , see —<br>topside galah !",-0.19658119658119658,-0.23076923076923078,-0.5384615384615384,0.07692307692307693,-0.38461538461538464,-0.5384615384615384,0.07692307692307693,-0.07692307692307693,-0.23076923076923078,0.07692307692307693,-0.07692307692307693
"entire body causes stomach pain, <br>friction by electric color vision. <br>and from the very greedy rotting brain ! <br>become chaotic sexual affliction. <br><br>i wanna feel my medical condition, <br>erotic senses causing aggravation ! <br>i wanna use this nicotine addiction ! <br>remote control and social isolation.",0.05555555555555555,0.5,0.0,1.0,0.0,-0.5,-0.5,0.0,0.0,0.0,-0.5
"the day is long , and the day is hard ;<br>we are tired of the march and of keeping guard ,<br>tired of the sense of a fight to be won ,<br>of days to live through and of work to be done ,<br>tired of ourselves and of being alone .",0.022222222222222223,0.2,-0.2,0.2,-0.4,0.2,0.2,0.4,0.0,-0.4,0.0
"you shall go binds you to wild and forlorn ,<br>at fifty one starlight 's<br>a forlorn anger that should stirred us<br>in the figure that sweet lives<br>are awful , truly be .<br>in my soul no vanish still<br>to your muse , when your go is",0.05555555555555555,0.0,1.0,-0.5,1.0,-1.0,0.0,-0.5,0.5,0.0,-0.5
"firm ; rest<br>in pity sleep , souls fast of sorrow ,<br>who left us to their sharp flown<br>the glory is no earthly place<br>where sick , when dying from the ranks<br>of heart that is full of splendour ,<br>and strong , and sin",-0.3333333333333333,-1.0,-0.3333333333333333,0.3333333333333333,-0.3333333333333333,0.3333333333333333,-1.0,-0.3333333333333333,0.3333333333333333,-1.0,0.3333333333333333
