poem,all,coherent,grammatical,melodious,moved,real,rhyming,readable,comprehensible,intense,liking
"on the “ poems of the king , ” he said , “ in the sight of my heart , ” <br>the angel said , “ my friend , <br>“ i am not fair . ” <br>“",0.5424883919925401,0.5424883919925401,-0.8354884129610939,1.1695918279303772,-0.9820423748373129,0.040008830587026395,0.45718837623216985,-1.3450382119579258,-0.6035914949606989,-0.5577281652280885,-1.084556749473508
"let misty autumn be our part !<br>the twilight of the year is sweet :<br>where shadow and the darkness meet<br>our love , a twilight of the heart<br>eludes a little time 's deceit .",2.0626102491250946,2.0626102491250946,0.8265523373861043,0.0251847977268332,-1.5347600474590453,2.0913861858650113,-1.6519436980371887,0.9715334097077143,-1.1684633784417844,0.5645508096291114,1.2920949991509498
"thou art the soul of a summer 's day ,<br>thou art the breath of the rose .<br>but the summer is fled<br>and the rose is dead<br>where are they gone , who knows , who knows ?",-2.1174142506114557,-2.1174142506114557,0.6133432459250726,-1.404348756250415,-4.074504510365462,-1.8047013396418252,1.8132316157432389,-1.5765019908334792,0.5701946552272273,0.5565148977162073,0.8542431821720622
"lord , from this prison-house that we have built ,<br>this dark abode of pain and misery ,<br>failure and guilt ,<br>we stretch our hands , we stretch our hands to thee ,<br>lord , set us free .",-0.24956094101225154,-0.24956094101225154,-0.6293636821446108,0.4269497683205562,-0.5241924241429684,1.6403161584025128,-2.565505538668953,-0.1722320498372595,4.17291970449913,0.9093902593149972,1.483910192492783
"in any case; and also being, you,<br>perhaps because, unlike, you are to fonts,<br>to water- chambers, water only to,<br>and water always ready, whether we,<br>the water, would enjoy or suffer, be,<br>again and now forever; being me,<br>i suffer being being being) we,<br>the bodies of the living only we,<br>the bodies living always only. b.",0.061558270853064805,0.061558270853064805,1.2296513722525424,-0.7819897899078736,-1.4635118237811964,-1.112924793962858,-1.2430195848115733,1.879683461210243,-1.3677417562747938,0.05118687718303717,1.3813623817613794
"and also mrs johnson had become,<br>in mrs johnson, mrs johnson used,<br>without regard, sometimes without the sum,<br>sometimes with very slight respect. she used,<br>without reserve. and always very strong,<br>without reserve. she always used her bruised,<br>expensive muscles, very lightly) long,<br>sometimes severe commands about the place.<br>and always mrs miller always face.",-1.7344253057170644,-1.7344253057170644,-1.914929572415189,-0.14927311658306255,-1.4141974096217373,4.118106801936157,-0.038523285352790405,-0.9804117106445513,2.0108848348048096,2.4644139830213865,-1.8125094696596
"besides , what vexed us worse , we knew ,<br>they have no need of such as you<br>in the place where you were going :<br>this world has angels all too few ,<br>and heaven is overflowing !",-1.040899462852036,-1.040899462852036,1.416375283429703,-0.031453079163912635,-1.0916793810750505,0.5746338679340066,-0.22428539441938705,-0.5837500964986507,0.3031917330172272,-1.5077943366571191,0.9711471213661249
"the wind that blows the way ; <br>the mountains of the sea . <br>the hills of the world 's dark night <br>from the sky to east and west ,",-0.195396170579827,-0.195396170579827,1.79694254138761,-0.32668508181424577,-0.4074661119456814,1.3912236818457404,0.4787594091917939,1.0910588250805697,2.0641153736739897,-0.9362314865058231,0.5935795322447639
"what sorrow is it; ah! that i must may<br>go back to gentle love?— but that is told<br>our children yet in garlands of the day<br>take off, and left it down, and to behold",-2.002801811191371,-2.002801811191371,1.233910383880445,-0.40929547360866775,-1.771667155396292,-0.2944609154850291,-1.7742017590024142,1.0729408968681293,-0.5499078624129015,0.9699677305669775,0.252462982803363
"i have desired , and i have been desired ;<br>but now the days are over of desire ,<br>now dust and dying embers mock my fire ;<br>where is the hire for which my life was hired ?<br>oh vanity of vanities , desire !",-1.2533252705780207,-1.2533252705780207,2.4679047448240556,-1.0251916900269933,-0.16154956453523953,2.0335220975223405,-0.4635918792807126,0.6227337650855231,-0.7190284694135592,1.1669154224913085,0.6957620646413164
"“ fine feathers , ” jack thought , “ make fine fowls ;<br>i 'll be envied of bats & of owls : ”<br>but the peacocks ’ proud eyes<br>saw through his disguise ,<br>and jack fled the assembly of fowls .",-1.3145821381182274,-1.3145821381182274,1.580790527039745,-1.1634682116126545,-0.14521130360732212,6.535834185108385,0.004685825199035499,-1.8214892468369153,-0.635321339499222,3.4450124582101105,1.002651921952766
"in thy clear eyes i descried<br>many a proof of love , to-day ;<br>but to-night , those unbelied<br>speechful eyes being gone away ,<br>there 's the proof to seek , beside .",-1.5297655901337261,-1.5297655901337261,1.0379447826321972,-2.8028207933249805,0.924331980860273,3.8962919867043895,0.3911454836214527,0.08289248615898669,-0.22044261471481286,0.30736405746411505,-1.8655316807673012
"it is not ever and for man's own heart<br>he falls in us upon her, what to see<br>he knows in all that honor which may be<br>and this, the type of all the fair of art",0.052883383376010035,0.052883383376010035,2.1757629356637094,-0.07591754017893332,-1.6914016973588055,2.3023389977756845,1.6829803102585978,1.0733544736273135,-0.455670438933024,0.32277485689857716,-0.1772112705211196
"the world grows stronger than the last . <br>the world is in the field of the sea ! <br>a thousand feet are singing <br>as the world is green and green ,",0.29829882182418754,0.29829882182418754,3.955678877971268,0.1697550266238799,-1.2496687061941847,1.986605233839678,-0.11399347579263538,0.7460283191174238,-0.6633066257807357,1.2137129267009428,1.1891944253845956
"long ago , the old and lonely , <br>the king and the free , <br>and the wild wind blows in the shadow of the sea , <br>a little cloud of london ,",0.7509495352670612,0.7509495352670612,1.6600808264858629,-3.563819584408748,-3.281462689454284,3.6993233282367415,-0.25122382645467073,-1.1765513576968394,-1.7020294362559116,0.3186430373083801,1.7018263744229427
"“ i 'm a man , ” said the owl , “ i know , <br>‘ tis but a part <br>of this great soul . as i , who fear <br>that i may see my kingdom cease",-2.958667467450584,-2.958667467450584,0.8169749969159559,-1.3384937248807178,-2.6984477493700947,1.492725002743094,-0.2647993252693837,0.1266355486135609,-2.879106830211593,1.7086838931192392,0.0768189739816675
"except my mother. nothing. ever, now,<br>to rival her) i was afraid to place,<br>without regard to beauty. i was( how,<br>exactly, does the human body end,<br>without the body of the spirit, which,<br>without which it is neither living friend,<br>beloved, companion any more. and bitch,<br>because, again, i wanted something more,<br>because, before her dying in my  for.",-1.1387860126522023,-1.1387860126522023,0.7944253200749639,-1.092150475204475,-3.8529815568143366,0.8571299812274057,-1.2015552680242456,-2.7790032954053983,-0.5255393274157838,0.5337192330761269,-1.2881224499187534
"looking teeth for quite to be moment :<br>large spark and gladness do ever ,<br>as noble heat and found that long might be ;<br>nor wanton heathen waves on our sad sea .<br>what is the message of",1.078738822383585,1.078738822383585,1.2890953905881772,-2.6677061136353872,-1.8285841686024278,3.2831751042034756,0.18826204824216955,0.010581828223199953,2.0662171741462614,3.1068170229056338,-1.100994681897324
"despairing cries float ceaselessly toward me , day and night ,<br>the sad voice of death — the call of my nearest lover , putting forth ,<br>alarmed , uncertain ,<br>“ the sea i am quickly to sail : come tell me ,<br>come tell me where i am speeding — tell me my destination . ”",-1.7698617221336002,-1.7698617221336002,-1.227563426089093,-0.2825844493837293,-1.7842983023329795,0.15162198139061014,-2.5437745335267246,-1.8700272318790279,-0.7912741443255412,-0.9329652996339033,-0.1991717697572417
"had heard her tears ,— to make her sweetness hold <br>love her , for quite of husband in her blood <br>a tomb away to clear an inner stead <br>of pride , with eyes and melted lips and thrall",-0.3424313816439605,-0.3424313816439605,3.437343446474811,1.150765987760317,-0.2445517683876671,1.378510810072028,1.9478984046676913,-0.4564587830222019,1.6110166406298618,2.4968808670901232,1.2502122252654742
"are very often wiser than we think,<br>because, among themselves they reason small,<br>and even silly matters, as they shrink,<br>from that gigantic light which reason throws,<br>and therefore know enough to suffer, though,<br>perhaps because we cannot reason those,<br>we cannot reason even our  that know,<br>and cannot read their hearts, unless indeed,<br>before the letter written to the speed.",-0.7888608128521798,-0.7888608128521798,1.2289469640456887,0.3628780777559677,-1.4485181517136758,2.9835473201793064,-0.019594508168351135,0.026836572539240034,0.033801877450038015,0.8780051051021827,2.577964529106556
"love , verse , the sun is in the west , <br>and the sun will be ready to put on <br>the poor old man ; and so he went . <br>he was a woman , and a",0.16733204475458627,0.16733204475458627,-1.8734841791613823,-1.3406641741478504,-2.6833091353527565,0.9579062377322218,1.8765702972899838,1.6677862524629814,1.5814001802680768,-0.0433834035230213,-2.054928172287443
"out of the rolling ocean , the crowd , came a drop gently to me ,<br>whispering , i love you ; before long i die :<br>i have travelled a long way , merely to look on you , to touch you :<br>for i could not die till i once looked on you ,<br>for i feared i might afterward lose you .",-0.07218703327580911,-0.07218703327580911,1.3781022784399668,-1.4924742141738447,-0.45167912479671796,1.1423955315166021,-0.28186952944473626,1.4420833003043858,-0.22241932947055212,1.6999990868293415,-2.1021467466685544
"higher , higher , gathering light ,<br>veiling with a golden gauze<br>all the trembling atmosphere ,<br>see , the rayless disk grows white !<br>hark , the glittering billows pause !",-0.34428842568434853,-0.34428842568434853,3.4118986145777868,-0.3545009284909798,-1.6605081628730072,0.9788865617577059,-1.7461630202462066,-2.7176098708619385,1.9848928147924658,2.300466780832453,-1.011188321086141
"too soon you went — we miss the cheer ,<br>the kindliness vouchsafed to all ;<br>the world seems strangely lone and drear<br>when one whom many hearts hold dear<br>fares heavenward ere the shadows fall .",1.3915132773745884,1.3915132773745884,0.8167486249892818,-0.37601421781816,-1.5102214751253973,2.9501223709331383,1.230252198172586,-0.16333516604393428,1.176869635660932,0.9072906447457304,1.018918575754209
"little lady icicle is laughing in the north-land ,<br>and quaffing in the north-land her wines that overflow ;<br>all the lakes and rivers crusting<br>that her finger-tips are dusting ,<br>where little lady icicle is laughing in the snow .",-1.5149575579229004,-1.5149575579229004,-0.735802352683776,2.457523454687761,-4.33943051266909,1.4340543564677994,-1.451046572325137,-2.953343890774013,-1.631806173302606,0.10594380909118183,2.631879306952783
"“ and now a flower is just a flower ;<br>man , bird , beast are but beast , bird , man<br>simply themselves , uncinct by dower<br>of dyes which , when life 's day began ,<br>round each in glory ran . ”",-0.3997063594867477,-0.3997063594867477,0.8556154981881418,-0.27960465220889946,-1.3519631094629787,1.469175220217431,0.09161931285097225,3.2831946960264733,-2.742248604799658,1.1290063117431295,1.2323045472595573
"i see all love in lowly things ,<br>no less than in the lusts of kings :<br>all beauty , shape and comeliness ,<br>all valour , strength and gentleness ,<br>all genius , wit and holiness .",-1.1454098753817887,-1.1454098753817887,-3.0437596331222236,-2.3164774754104607,-0.2584873854250791,1.9831145330667053,0.649467119268172,-0.020578554811276958,-0.6816223670716085,2.2422008184459674,0.9722165012727619
"come you , my careful flock , forego you master ,<br>i 'll fold you up and after fall a-sighing ;<br>words have no worth my secret wounds to plaster ;<br>naught may refresh my joys but phillis nighing .<br>farewell , old demades .",-0.47306966498403324,-0.47306966498403324,3.1559381214194118,-1.8600480407024973,1.1590227550574952,-1.0575581210745513,-0.15180065802660642,0.5785076745424313,-0.6519154158420055,2.804585006173168,2.25605412637461
"to see some very little brighter tone ! <br>my name was never even morgan fisher. <br>but then my only human baritone, <br>has taken something from an old beginner. <br><br>another crazy alto saxophone ! <br>is there too many people being played, <br>or blinded by dynamic microphone ! <br>this feeling like a heavy metal blade.",1.2501587439607176,1.2501587439607176,1.5487688840425085,2.4697038584936646,-1.0612075861480548,5.963916073173968,-2.0338738915923664,0.3728024929082917,0.7490029568971837,3.1405329635257315,1.80726148938056
"the song cried ever in the sheets of life <br>and when beneath him bars him o'er the moon <br>here in his breath he laid himself to be <br>a man i call him life , his early growth",-0.7713318722303368,-0.7713318722303368,1.2133746169858162,-0.5625885838343134,-2.4566305846161294,1.163584704485029,-1.6185246240359081,0.10594006452040712,1.6835399156150774,0.7279556613207218,1.6665240554033611
"has not , since then , love 's prompture deep ,<br>has not love 's whisper evermore<br>been ceaseless , as thy gentle roar ?<br>sole voice , when other voices sleep ,<br>dear under-song in clamor 's hour .",-2.275263385019137,-2.275263385019137,-0.1675897168404443,-1.0948740613682084,-1.4001343658689411,0.35314998382192986,-2.90657139491601,0.5487831952886955,1.5722608016679396,3.2688393451376556,-3.8809586280597754
"i knew your pain , and it broke<br>my fine , craftsman 's nerve ;<br>your body quailed at my stroke ,<br>and my courage failed to give you the last<br>fine torture you did deserve .",-0.16339664903884413,-0.16339664903884413,-1.5331956412702124,-1.9251433819562702,-3.724712443049516,1.3773155309650553,-2.5290951567708486,-2.895606637129382,-1.2239952002423218,2.4317065461715357,-0.7226623819032235
"come in my wealth , and poor — and furious woes <br>the left , and sooth 'd them to the chin his fire <br>god led me with the wonder of ulysses , choked <br>i think of what , o lord , for those which hear",-1.3444268066601333,-1.3444268066601333,-0.7235967538927449,-0.2500019955027195,-1.1173647885509588,1.1859626821880769,-4.920130068629585,-1.037105340141507,-1.6330515115070683,-0.5926888582660864,0.4282916072430871
"my father , if i might be a king , <br>if aught of that loved and fame , <br>i might have been but the deed of life to come ; <br>and the strength of the banner in",0.37446091592701786,0.37446091592701786,2.6684886222126645,-3.211583515989534,-1.1207779995353573,-1.9359410633372334,-2.233581355256887,1.9335405784801536,-3.1483356062131573,3.775899141989357,1.0223505894060996
"she swaying a fly in victory ,<br>she , the woodland earth is blossoms<br>they passed will , then , were captive dusk ,<br>all the them in their beneath one blast to the water in his clear<br>that nobler thro : ‘ stir<br>thou earnest , mean",-1.618613976782743,-1.618613976782743,1.7690350765790828,0.662382070839282,-1.9336851810365816,1.6146482414799346,1.2101868231366568,0.04944679055348835,0.7139633925778722,1.2073285481901146,2.634865721526785
"there is no wind to stir the leaves ,<br>the harsh leaves overhead ;<br>only the querulous cricket grieves ,<br>and shrilling locust weaves<br>a song of summer dead .",1.6100900117671613,1.6100900117671613,-0.726549610935681,0.36225307731188816,-2.773429785760828,0.09822404815465652,-0.9132175148272752,1.4938294482017376,-3.060697405359137,1.9793399732369243,0.715972687488597
"the magick gan , to all his flight hovers <br>but heav'n of them were lost and blend <br>with that not fickle , nor burnt , nor father 's brows <br>to see , with slowly sometimes cursed and lights",-0.42856911343397025,-0.42856911343397025,0.9502966663785469,-0.9765160331481897,-5.095461884379916,-1.1095135697467078,-0.45427752501311564,-1.8695646968177808,-1.0460057019070073,2.200703948750964,-2.348243338046417
"not ev'ry; but so much as he will say<br>was always as it was upon my breast<br>and to this day, shall put his crown on last<br>if he had changed his summer, grown away",1.4267685309395024,1.4267685309395024,1.4587722379993664,-2.051310212115944,0.5066362301207891,-0.24070921845683965,-3.584194501704862,0.7674665590297925,-3.4529486635548716,0.8646389783737479,-0.7382704451044374
"but still the children of those exiled moors ,<br>a sad transplanted stem on alien shore ,<br>keep as their trust — and will while time endures —<br>the rusty keys which their forefathers bore ;<br>the keys of those shut doors which ne ’ er shall open more .",-1.0446938645657016,-1.0446938645657016,1.3713959900227237,0.7417289976277243,-2.2370210390477716,2.3488237518494226,1.09557742630026,-1.40885665277249,1.0157909684147175,2.7882161415658784,2.1552827038657423
"who for his dog had got the old man's john<br>that he has left us for the gown he true<br>has past to follow, here my way to run<br>and calls upon him, and will let him go",-0.11184180599735903,-0.11184180599735903,0.4155861151067852,1.298512419342873,0.5684170005776406,-0.16969955620250163,1.0399402269379705,0.4633499985812319,-2.809898324885976,-0.808111594148833,1.0149284918419663
"not even going over aaron carter ! <br>that crazy super funky old roulette ! <br>so mister mister mrs. tupac shakur, <br>this little party at my private jet. <br><br>some people wanna sing the latest lingo ! <br>too many people starring jennifer ! <br>they need another music video, <br>or maybe something like a fortune teller.",0.040261011311594375,0.040261011311594375,0.743206790273026,-2.060985194799353,-2.347852446059803,1.1508480941428054,0.241476556190648,-1.3954588201755875,-1.048706646826582,1.201273925854436,0.0303377849785563
"yet whoso thinks he moves himself his best<br>is to her lord: she is a child of all<br>and all the life she run, and sinks to fall<br>at last, he left her with him for the rest",-1.3987196865059517,-1.3987196865059517,1.7965105529214147,-0.2732886351882362,-1.1805872136928586,-1.001824143132204,0.11011084105415185,-0.15992739403088962,0.7886644499389336,0.07648397751671371,4.717940714532613
"of flowers, flowers, roses. flowers are,<br>indeed. i wonder what he is on room,<br>on sofa? is that fellow sleeping far,<br>or eating something other than dessert?<br>perhaps, beneath the evening skies of ice,<br>he watches us. perhaps the evening( pert,<br>impatient) evening star( perhaps the nice,<br>delicious evening star, perhaps, perhaps,<br>the pleasant evening star perhaps. he taps.",2.4648733853793576,2.4648733853793576,-1.5728767111764683,-0.47239963302546706,0.30890543787733765,2.203843854716922,1.8571655249061882,1.291616786965966,1.8285887555639087,-1.2972468434052142,-1.4560939557790726
"do n't desire the churchyard friends ?<br>here i am destruction ;<br>my love breath and face for the truth if truth cheered the dead ;<br>and when go softly gently , and it disdain ,<br>as she early comes me in — then the loyal the",-2.8508218168578345,-2.8508218168578345,3.3732485369836422,-2.781890699493822,-2.5533013258624857,2.2173651567906925,-3.1670335165762733,-1.2042670111341456,0.23952719546666795,0.91234406690475,-0.888768400355009
"if , should record certainly , the loveliest soul<br>all sweet in god 's best phantom ;<br>memories and woe , as hate<br>wild despair had fix ;<br>in hate of flitting turns ,<br>thrill to the wild with your",-0.31168628300645135,-0.31168628300645135,1.0387944251517462,-0.38404702611938496,-0.8369971970876344,0.6926047720457426,-0.06554135281168612,-1.2894938861800975,-0.6065060410377838,-1.0955476950315186,4.685110799274498
"their tender neon stars are burning bright. <br>she sits and though it only catches thunder, <br>or when his love is nearly outta sight ! <br>her hair has never gotten any rougher. <br><br>no other woman needs another flare, <br>that bothers me so you can hardly bide ! <br>the very pretty little crimson glare ! <br>extremely easily identified.",-0.25207092472434733,-0.25207092472434733,0.2717936357803888,-1.4558985750180595,-0.07251774431762015,1.1967161817303986,-0.7481198728862991,-2.199350474624874,0.8698803103643207,0.3278968517323687,-0.9098206510930394
"we think not what it is; so still i pray<br>i hear and ask that for it will to be<br>never is willing to be strong and free<br>so, as we will, when all the past was day",-0.5637639726883327,-0.5637639726883327,0.8548776705028515,-0.75857190484327,0.9164917810371229,1.6954398230379224,1.8047352942778407,-0.08088438490319681,-0.3363398343824811,2.771965187208031,2.8705433444762947
"before, before, behind, before and, well,<br>behind before, before, behind. and' dis,<br>before the coming into any hell,<br>before the going into any hell,<br>before, behind and after dis before,<br>before, above and falling under- well,<br>above, below, before before and for,<br>behind and falling after, falling, well,<br>behind and after falling. well. the. hell.",-0.6593081964080354,-0.6593081964080354,-1.8382423225995634,-0.4144941074462299,-1.0199307427107513,0.013382182440355762,-1.916101842444018,-2.224872373755611,0.8929260152437365,3.4835700424809377,-1.9631406934230002
"the castle of our desire vultures we found <br>weigh we [ a bower not full many a fold <br>the corse, the gipoyson, and the ponderous heave <br>we bring it,— the castle of anuplus <br>the castle with a clock",-2.2367857047352078,-2.2367857047352078,-1.8815222778031835,1.8278588425685836,-0.041538898182474956,1.658950711668618,-1.9065780035095463,1.2228832958580969,-1.6350158362173106,-1.1846068529018907,-0.9248493049337146
"[ exulted ] mean 3 come wheat old nook went ,<br>and there 's glory panting o'er the sky ;<br>god help us a mother money wondrous life .<br>in dreams earth i saw the sun<br>whose spirit makes the angry child<br>along won all her little while .<br>“ you",-1.3714271054774982,-1.3714271054774982,-0.8958820317999495,-1.0676358139144047,-2.998239747757385,0.0021893063112624184,0.5192764664698544,0.7206151483606578,-4.214829459834426,2.4068036651985514,-0.549322624976131
"the clocks are chiming in my heart<br>their cobweb chime ;<br>old murmurings of days that die ,<br>the sob of things a-drifting by .<br>the clocks are chiming in my heart !",-2.9135082975066564,-2.9135082975066564,-1.379766517812031,-2.663902768020948,-4.20310491882626,1.2320744102488757,-2.442245148969182,0.9972351089862046,-2.7885663879264206,-1.0297780040970022,-0.06630292487267822
"my blades , before my chaunt i end ,[ 14 ]<br>here the rag-sauce of a friend ;[ 15 ]<br>ne'er trust to any fancy jade ,<br>for all their chaff is only trade !<br>fol , de , rol .",-2.5085838180907007,-2.5085838180907007,2.1537067571534174,-1.1904296558283238,-3.844340085243579,0.12865310474942654,1.4310632466289224,-0.01301830671218164,-1.5654816032516203,0.09256605696055921,-0.25217656046422454
"from the earth that waits for thee , <br>and the best of all the good . <br>but still they still are gone , <br>while the voices that runs ever met",-0.5649850171585713,-0.5649850171585713,0.14014572183739266,2.0274321691879726,-2.988711470925067,1.2614411706105026,-0.4072762281393869,-0.8082741520485498,-0.057984825860051645,-0.2560740579436777,-0.6438119821774151
"some gentle spirit — love i thought —<br>built many a shrine of pain ;<br>though each false idol fell to dust ,<br>the worship was not vain ,<br>but a faint radiant shadow cast back from our love upon the past .",1.8445443051660286,1.8445443051660286,1.1545533522407592,0.7948643619273845,-1.9849745524728677,-0.7577689904505833,-1.2070115412101114,-0.7320871354195099,0.594589742035733,-2.1559667930249917,-0.6541487918671041
"the trumpet of god , obeyed on high ,<br>his signal to open the granary<br>and send forth his heavily loaded wains<br>rambling and roaring down the sky<br>and scattering the blessed , long-harvested rains .",-1.2344112372482539,-1.2344112372482539,-0.9527123048519128,0.35563217046198364,-4.332177353265473,0.593605196323154,-0.6390713725422734,-2.2901673073986037,0.31957024096300113,1.8556282248311486,2.543301055616921
"the world was in its day of peril dark and bright <br>wont to believe the dot of fond love, with sapphire <br>from whence the woman's shafts for joy or thee <br>thou wast in love with her locks of doom <br>o! if the grim world were w",0.027927123335943885,0.027927123335943885,-0.4825186532332169,0.7781803345280005,-4.183514217605957,-2.232770360775464,-1.3910141062511032,0.530807866848065,-1.8344890088215002,2.644341172052737,1.8618363009938352
"even so my love may bring me joy or woe ,<br>both measureless , but either counted gain<br>since given by her . for pain and pleasure flow<br>like tides upon us of the self-same sea .<br>tears are the gems of joy and misery .",1.303368169938566,1.303368169938566,3.462172423659098,-2.8679955464524673,2.2591317842528893,0.15106870347497853,1.9354307364522545,0.08186062620543952,-1.041643115432755,1.3713778176120652,-1.1975547699103146
"the castle of our desire vultures we should defend <br>and blot the modest el vines with fraternal rage <br>spread like a bessoon take of the wolves to gain <br>the castle and the hall of the devil's grim <br>the victims, girded as the bearers of air",-2.12470617128469,-2.12470617128469,1.658000640402936,1.6506324466612532,-0.009706035813737168,-1.6572861687939477,1.4156934471373916,-2.8635988824361447,-3.1147060036130885,1.4843718927672382,2.828272766783063
