poem,all,coherent,grammatical,melodious,moved,real,rhyming,readable,comprehensible,intense,liking
"if hope , when she lured me and beckoned ,<br>had pushed at my shoulders instead ,<br>and fame , on whose favors i reckoned ,<br>had laureled the worthiest head ,<br>i could garland the years that are dead .",0.4359893610049028,0.4359893610049028,1.3515380422398875,0.92843677153616,-2.218325020212421,0.7994419022359426,1.7593189209403104,-1.7719037325637108,-2.4597789815301945,5.944211492555355,2.3857323321313415
"yet, rich in honour all of men was kind<br>for when at last she held with his command<br>and peer a patron of the gods to stand<br>and thus the husband pass'd him to his mind",-1.8642370750186412,-1.8642370750186412,0.8885633954350388,0.6691090223433862,-2.025695973716934,-2.4477777740548734,2.3319594315015495,-2.26573155979968,2.811626673145051,-0.39767490141941103,1.8541885606417012
"bind up , bind up your dark bright hair<br>and hide the smouldering sunken fire .<br>let it be held no more than fair ,<br>nor yourself guess how rare , how rare<br>its movement , colour and deep fire .",0.4539034280250487,0.4539034280250487,-0.19688747347177846,-4.467384979067327,-0.5039464597473379,2.0928910355111374,1.4468037661511952,-4.600645485979301,2.8247604338302925,-0.06846801886758996,-1.1347587886838004
"she was only two , but she understood ,<br>and her small , rosy mouth was made up to cry —<br>but no ! she would talk — she would show that she could .<br>and , “ mamma , ” and “ pretty , ” and “ laly ” — “ by-by , ”<br>she said with a wave of her hand !",0.9363622686718408,0.9363622686718408,3.589861548154954,1.744700429912346,-3.7960222048169103,-2.1590870742891233,-1.2635748149221926,-3.759017961255896,-2.5150063387012187,-1.3729100166697663,2.2419451063176425
"about thee , enemies and revellers !<br>but thou wilt hear , and look , and wait for none<br>but him ; and on thy loom thou weavest always<br>and then unweavest the thread of thy true love ,<br>penelope .",-0.37325858432933645,-0.37325858432933645,1.0423748291276016,-0.03620117516073062,-1.5929529173685395,0.5331381114297611,2.724807716099773,0.27187965741177406,1.7362418221977003,0.1111137653731427,1.9662724201302986
"would flow across this very wavy line ! <br>to see how many other sided die ! <br>they know that distant mountain may align, <br>upon an island under western sky. <br><br>so many horizontal axis shows. <br>its only one another solar sailing ! <br>surrounded by an ancient compass rose, <br>is moving at a thousand upward facing.",-1.6709938737493837,-1.6709938737493837,4.2398905844962265,1.4469318013687984,-4.040513253902833,0.5207962152702176,1.8147945089232413,1.7813037559668878,-1.6219357211436358,1.233954386448608,-0.8565254551961244
"for very many famous holy days, <br>and early morning public holiday ! <br>we may not even public holidays ! <br>i know about another martyrs day. <br><br>what else is there expecting me to swap, <br>with only one exclusive interview. <br>he sits upon an open corner shop ! <br>the other side of seventh avenue.",-0.9111239556434743,-0.9111239556434743,0.16953322068882448,-2.524464293215901,-3.3253146835352765,1.6661097295153475,0.3268420010275762,0.6305879703181166,2.1766254147289286,2.0313741523823317,4.698680987712479
"or is it an elephant , white as milk and bearing a severed head<br>that tatters his broad soft wrinkled flank in tawdry patches of red ,<br>with a negro giant to walk beside and a temple dome above ,<br>where ruby and emerald shatter the sun ,— is it these that should<br>please my love ?",-0.14272452886953982,-0.14272452886953982,1.5665435922452058,-0.3850071002770992,-1.3435496585753564,-0.16425732356858366,-1.8973382669340526,0.07071304294872155,-2.3302411499388356,1.7562850669221661,-0.30779914708139144
"prince , may the bright-winged brood of æolus<br>to sea-king glaucus ’ wild wood cavernous<br>bear him bereft of peace and hope 's least glance ,<br>for worthless is he to get good of us ,<br>who could wish evil to the state of france .",-1.0442672094913514,-1.0442672094913514,2.0295988762162587,-1.0557006323178983,0.8772901389010699,2.1298656517891574,2.7571037110677525,-0.8704109936934358,0.5108863263798566,4.256077263235082,1.6537756591542285
"i still , though conscience urg 'd ’ no step advanc 'd <br>e'en now i feel , and tells to harsher wing <br>whereto i breathe , and goddess thus they feign 'd <br>“ lo ! ” the first virtue fram 'd , the chief complain 'd",2.010594207534192,2.010594207534192,-1.9973317879748231,-0.02861099451307974,-1.5460633957853478,1.676991459852602,1.841188314985107,-0.056822754700528014,-2.42997386857895,2.5173820819386936,2.3334176131388
"talk what you please of future spring<br>and sun-warmed sweet to-morrow :—<br>stripped bare of hope and every thing ,<br>no more to laugh , no more to sing ,<br>i sit alone with sorrow .",0.45048968570159587,0.45048968570159587,0.6493804501979799,-0.31533853235740794,0.4809435957564229,0.8741003401752502,0.1461437660193824,0.16619365159506813,-0.1452051590564623,1.4573462955672012,1.1053096478714706
"and in the punk-wood everywhere<br>the inserts ticked , or bored below<br>the rotted bark ; and , glow on glow ,<br>the gleaming fireflies here and there<br>lit up their jack-o ’ - lantern show .",-2.4087235887237033,-2.4087235887237033,-0.8372584908125432,1.144780665737661,0.35045180529795666,4.955285602400401,-0.24959905264749704,-1.078353383477251,1.3257193880769058,-0.5238334722964829,2.644728892138702
"however ( being also human ) not.<br>i am afraid. because, despite our sham,<br>our public faces ( being public) caught,<br>among themselves ( because among yourself,<br>among yourself alone... because among,<br>amongst yourselves, among themselves they elf,<br>because, despite their noble cover young,<br>despite our noble faces, being, still,<br>among... because, among themselves. i will.",-2.497976503669776,-2.497976503669776,2.712535588056033,-2.0732331671706663,0.8605467100344583,1.9426159319522076,-1.8171648938478717,2.6258032048712967,3.3472558216532002,-2.197488680368503,-2.7727565950645743
"we are not daily beggars<br>that beg from door to door ,<br>but we are neighbors ’ children<br>whom you have seen before .<br>love and joy , etc .",-2.440632530543764,-2.440632530543764,0.8696077776211695,-3.4603874684490967,2.2025419609957,0.13200342357990702,-2.216826076386067,-0.7622216972033137,-1.5090028356697933,0.9418991583077109,-3.757329161281327
"my second should bring pride and joy<br>to parent-hearts , alway ,—<br>should bear the fresh soul of the boy<br>into the earnest man 's employ ,<br>and ne'er from honor stray .",-1.0233178065877309,-1.0233178065877309,2.140626262078175,-1.0109753408534365,-0.6551033862388936,1.8655630433754098,-0.20913250758190394,0.2554133033694632,-1.0475862113006413,1.3301629965082096,0.8124695764808615
"i have a certain time , <br>and in my country 's cause in the dark . <br>the little time , the day , <br>and i must go to sleep ,",1.6373765329433339,1.6373765329433339,2.2161167796277716,-0.03597111583652056,-0.5689975251199934,4.603642789035143,2.6458243187385455,0.35355035360106657,1.3763754370998316,1.7106985853043302,4.0501444539862455
yet either from that happier race<br>will merit but a passing glance ;<br>and they will leave us both alone :<br>poor savages who wrought in stone —<br>poor savages who fought in france .,1.2910832458310249,1.2910832458310249,3.2528318206573625,-2.0938749026398544,1.4767802548942384,0.39667459351943557,1.379002671746879,-4.710630982821394,-0.5329725975681211,1.4369865452928225,1.8038382711087326
"the castle of our desire vultures we should not thought <br>we saw the anted quarry and lone pen <br>wonder it seem's long since, with the lily charms <br>a stranger, yet idle in the hall <br>that its bloom would upstart were not thought to speak",-0.5565866479397998,-0.5565866479397998,1.268021878734216,0.9031878363531863,-3.0628081934393445,-0.4306519201284305,1.3658178470929303,1.3287108810911124,-0.49507464039383936,1.5282585933867037,0.3943753916935891
"so people , passing under<br>the ash-trees of the valley-road , will raise<br>their eyes and look at the grave on the hill , in<br>wonder ,<br>wondering mount , and put the flowers asunder",-0.9040958201818073,-0.9040958201818073,1.116853870187162,-0.27638568047532164,-1.1189720992022816,1.8566175386676271,-3.580733074868921,-3.0481060223308263,-0.5276755604971112,3.507621592560737,1.2431853299089608
"press her lips the while they glow<br>with love that they have often told ,—<br>hereafter thou mayst press in woe ,<br>and kiss them till thine own are cold .<br>press her lips the while they glow !",0.20775632168447059,0.20775632168447059,3.463430358380225,0.8786860099341861,-3.114394790601106,2.2733675123665407,0.9873104039213003,-2.330852892035877,-2.2286401147475776,-1.436569944622377,1.4034183648241993
"yet can he, like his man; such wonders well<br>there mingled on him vast in depths of hell<br>and manifold a greatness on the shore<br>all deserts in the desert, and no more",1.7893082683469188,1.7893082683469188,-0.3891082396116559,-1.1397398045666065,1.154595354192672,0.7472128180835795,1.4797203903065357,0.07502850635043447,-1.9948278250756202,-0.7089707089888063,2.7801389024898673
"knowing you were barely really seeing. <br>but yet a hundred thousand horrified, <br>are blessed with something very often seeking ! <br>they may remember when his mother cried. <br><br>and though he kept a little longer willing ! <br>but then another one disguised herself, <br>too young to know that love was only fearing ! <br>the way a father died upon himself.",-1.4573176247745925,-1.4573176247745925,4.078882228289682,-1.960229294753605,-2.352564301167013,1.0152657465625767,1.0397805563372675,-1.72408554340336,-0.9167296031018094,1.526179562711345,0.3374753240498485
"followed my boy , to whom the beggar lies <br>o ye of england ! for ten times lord <br>the same with sweetest and troubled eyes <br>is to believe all the world in stress",-3.57911312710636,-3.57911312710636,6.104997349646701,-1.5445504159540355,-1.3646743581091592,1.0711718321791974,-0.4921764115289459,2.2005150131596567,-2.2273717255082173,0.21690196386975782,0.6781790173453159
"it is time to arise ,<br>to race for the promised prize ;<br>the sun flies , the wind flies ,<br>we are strong , we are free ,<br>and home lies beyond the stars and the sea .",-1.6411934045415904,-1.6411934045415904,-1.6442091840715918,-2.1648002805387336,-2.0107349713803733,-1.013227647047756,-1.438097919837071,-1.2447798778685837,-2.438975261633254,-0.6147006398815058,-1.3517851011269577
"darkness and solitude shine , for me .<br>for life 's fair outward part are rife<br>the silver noises ; let them be .<br>it is the very soul of life<br>listens for thee , listens for thee .",1.5868569420930605,1.5868569420930605,-0.4275431606241532,2.824351082308788,-2.6032829360285024,4.259203324317539,-1.689145340225079,1.4791591222053326,1.6367458376948671,0.029342778270936096,-0.9142929741427522
"the castle of our desire vultures we should not thought <br>we saw the an abused in the waste of light <br>the heat was great, but we could not hide <br>the fire was dim, but the foxes were spoiled afar <br>the vale of the holy water would not bare",-1.8665218307920555,-1.8665218307920555,-1.5613445276152966,-1.568445183670592,-0.547774180478482,-1.6793408643020609,2.3574993308840493,-1.457207546811762,-1.4575094905137054,-0.9362657942364724,-1.2462654688447565
"and twice your shade resistance will give friend <br>of truth and well she is your ease to kind <br>with sickness on her face upon the breast <br>who makes much wist of my soul , who fill 'd",0.16883326424648087,0.16883326424648087,-0.7435290894490105,-1.9947635409626203,0.6339556472901927,1.3029244039730192,0.16851207220907935,-0.8186436421241164,1.1587943723532899,-0.8863999297376538,-1.8277248876817203
"they fought and they talked in the north and the south ,<br>they talked and they fought in the west ,<br>till the waters rose on the pitiful land , and the poor red clay had rest —<br>had rest till that dank blank-canvas dawn when the dove was preened to start ,<br>and the devil bubbled below the keel : “ it 's human , but is it art ? ”",0.845042943092409,0.845042943092409,-0.7186790737717086,-3.572844882052486,-2.1471600958631183,0.5176405631224965,1.6287395145840504,-1.0565331890816279,2.227790091603873,-1.8496375369674203,-0.033253508040515856
"the loss , if loss there be , is mine ,<br>and yet not mine if understood ;<br>for one shall grasp and one resign ,<br>one drink life 's rue , and one its wine ,<br>and god shall make the balance good .",-1.526383395833244,-1.526383395833244,0.14123465589450554,-1.8795868281364998,-2.2192152515505637,-0.9158842290391586,-1.4756652227353901,-2.331345931012756,-2.576460935415506,-0.28177866921548544,2.505173512568001
"well , and if none of these good things came ,<br>what did the failure prove ?<br>the man was my whole world , all the same ,<br>with his flowers to praise or his weeds to blame ,<br>and , either or both , to love .",0.8053639403642967,0.8053639403642967,0.24041187155970542,-0.32394197837067307,-2.845468847566917,-1.6320578871238887,1.825979278596476,-3.0337731159622368,-1.3821559311294225,-1.5397703567848529,0.5459826888785333
"in all my days, a sadness of an hour<br>how should it be to find me soon am i<br>when the wild birds, and summits of the sky<br>or silent spirit on a distant shore",0.37672441066379464,0.37672441066379464,-0.4499886020779286,2.6442376280616915,-3.536694085181999,8.14762515965504,-1.6258437848533203,2.4648536187808485,1.7472117274707513,-2.197930993047927,-1.4666550468330841
"and not far , i believe , from quarter of seven —<br>he was slow gettin ’ up , the road bein ’ uneven —<br>found the stranger dead in the drifted snow ,<br>still clutchin ’ the flag with the motto —<br>higher !",-2.109312631823064,-2.109312631823064,-0.30696432252404104,0.6162434601925325,-2.840990614673252,-0.19548926892268093,1.8426836457892226,-2.696522782121869,-1.9425587077513828,1.0061306155635044,-0.0219031896826772
"how many a year , my asolo ,<br>since — one step just from sea to land —<br>i found you , loved yet feared you so —<br>for natural objects seemed to stand<br>palpably fire-clothed ! no —",-2.169353269609953,-2.169353269609953,2.1152763345062886,2.0858542985427393,-1.9140017642119382,-2.659178393865599,-1.2279253908180248,1.3041237914027297,-1.4094275380204708,1.371774906618404,0.02100053802979282
"a dream of drouth made audible<br>before its door , hot , smooth , and shrill<br>all day the locust sings .... what other spell<br>shall hold it , lazier still<br>than the long day 's , now tell :—",-0.7746732048006023,-0.7746732048006023,0.9126231863279464,1.0195731491170636,-0.6007514472545417,1.7578351771105227,-0.4895002865158293,1.1620822559828785,-0.9677802402641792,1.8251639834142948,-0.613686195284489
"as i sat musing , ‘ twas not one but ten — -<br>rank on rank of ghostly soldiers marching o'er the fen ,<br>marching in the misty air they showed in dreams to me ,<br>and behind me was the shouting and the shattering<br>of the sea .",-2.6577705851683557,-2.6577705851683557,3.093020744300553,-0.21286424408532242,-3.687662793275152,0.5995783914155968,2.1026079487000193,1.4024512688591055,2.0788667783897816,0.6719098732628437,-0.6289942535376605
"back to thy strife and lady of this fair<br>so still it is a sister! and most dear<br>dearer than i that mother, which she bears<br>the children, drops upon the lips of tears",-2.0060134503480613,-2.0060134503480613,-0.49218771116391224,-3.2042007813740625,-2.6616472876396085,-1.1335426575499399,2.2572084738701967,-2.2071442871314915,0.8308953506322434,0.8175473554828719,-0.65534639175599
"still nearer , and our europe doth desire <br>in this pure tempest shall his cares impart <br>oh , mourn what truth good rapture brings divine <br>with me to see their god is fearfully",-1.3254734613800574,-1.3254734613800574,3.9720502935570794,-0.20270585537993122,-0.5514011614564784,1.7751838456981872,-0.06634300639492662,-1.9953302129557902,0.21102248567092718,1.2163160840572593,3.2033920474815685
"and said, he had received the armor, which,<br>however he might have removed from men,<br>had never hindered them from serving rich,<br>and having pleasure in their freedom, nor,<br>moreover, ever hindered them, because,<br>indeed and deeply speaking, they were your,<br>possessing neither substance nor of flaws,<br>and having all the virtues under sun.<br>but, even granting all of this he won.",-2.829829828394529,-2.829829828394529,-1.4820625673597438,0.737981622836142,-3.2007370459714144,4.01196351640775,0.10878356117190377,-0.43497004019559693,0.7445186670127801,-1.2897885177295845,-2.3029182086393263
"a drum of it out of “ living another by one ,<br>o east and prophets .<br>life makes earliest charms through this flesh !<br>can give such pain , up her hopes to day ,<br>and eden where you must bear it in plan ; this through<br>admit after years , all",1.8242462274954279,1.8242462274954279,3.2147345635270717,1.1399963015233414,-2.1758628108139457,3.5544891226411033,2.3779156193784523,1.5591710083902999,-1.9300961200938072,-0.8420747555368902,1.081080224249598
"and caverns frozen on the sparkling air <br>leaving all the cells of waves and deep <br>true three ! and rise again , now and i hear <br>floor 'd with shrill jewel , hero 's hair , obscene",-0.3349470100968706,-0.3349470100968706,2.4957375988014383,-1.9395908830209807,0.21701306964769124,0.7301997482877742,2.383783581845574,-0.05329183934605122,0.9655899447264454,0.8732365010832416,-0.7088462602744587
"the castle of our desire vultures dozed quite <br>though meaner than the meanest wanderer is <br>the meanest serwis the meaner when he servaz's confined <br>the stay of an stay with his wanderer to spare <br>but he, as fer as when",-1.4590042374412202,-1.4590042374412202,-1.155347723844104,-2.4607084079896957,-1.973224575297966,-0.5299003835915884,0.8432975150832769,1.500663813848798,-1.5424648129346294,0.7759067572096343,0.5308890239791334
"i for instance might groan as a bag-pipe groans ,<br>give the flesh of my heart for sharp sorrows to flagellate ,<br>grief might grind my cheeks down , age make sticks of my bones ,<br>( though a queen drowned in tears must be worth more than madge elate )[ 1 ]<br>rose might turn burdock , and pine-apples cones ;",-1.5925565792420906,-1.5925565792420906,2.003591709529045,0.6774901078275315,-0.8707328264770532,0.9282484721494884,-1.8171604378954125,-0.1846197831450934,0.14049492253376364,3.5425808464007,-0.1202148887407088
"at morn , beside yon summer sea ,<br>young hope and love reclined ;<br>but scarce had noon-tide come , when he<br>into his bark leapt smilingly ,<br>and left poor hope behind .",-3.4406988466348287,-3.4406988466348287,-0.951985598158018,-1.5052299055389968,-2.546379154635799,0.10836600479435099,-1.4947758322550788,-1.8271211552865105,-2.216085090923105,-0.722314037520432,-1.8695498834153543
"strove the cunning men and strong ,<br>but a little and they cry ,<br>“ lord , mayhap we are but clay ,<br>and we cannot know the why , ”<br>and the wise men doubt to-day .",-0.9739264244799887,-0.9739264244799887,0.7291692366676424,-1.8696652280864274,-2.1013222393965365,3.2896752644656826,-3.5162976752132558,-1.6414002040045277,-1.1274518124008326,-2.4957971701750323,-0.8010485835619027
"that , guard with age if he would ever bind <br>till all his awful names are human light <br>reserve his faces in the light <br>in every form the other then embrac 'd",0.7288569148523334,0.7288569148523334,-0.19709692700007606,2.059758832356581,-1.5562039059904431,-0.1676263548601598,2.3648763986355115,-5.196250974853036,-1.5596836244880106,2.389586665127386,2.7865722252728764
"i soon forgot my book , and though<br>i loved it just the same ,<br>i could n't cry and miss it so ,<br>and think about each picture 's name<br>when all the clown men came .",-2.7726396517923195,-2.7726396517923195,-0.7284332123251763,1.5313107108901072,-2.7829706219183192,-0.23021081800604207,-2.181271551844965,0.37153752977217147,-2.742020915411847,3.9128840865972943,3.803698678277905
"and to halt at the chattering brook , in the tall green fern at the brink<br>where the harebell grows , and the gorse , and the foxgloves purple and<br>white ;<br>where the shy-eyed delicate deer troop down to the brook to drink<br>when the stars are mellow and large at the coming on of the night .",0.7080838206472981,0.7080838206472981,0.2577502834506966,-1.3648846434963313,-2.2232338950731485,2.773719014275863,-0.9872454103118353,0.5879899259629656,1.411337803283336,1.42995044781297,0.578297226180818
"the moon was a long gray old trees <br>with the open of the sky , <br>and they left them out of the lake , <br>and the spring will come and go ,",-1.2046548866692715,-1.2046548866692715,0.970004721591953,-3.364367217211702,-3.4200561243377035,3.123917668818481,-1.0522322327324403,-1.8748012315650766,2.060533317733962,-1.0175424881204196,-1.9391537415726587
"the might-have-been with tooth accursed<br>gnaws at the piteous souls of men ,<br>the deep foundations suffer first ,<br>and all the structure crumbles then<br>beneath the bitter tooth accursed .",-2.9597325574591316,-2.9597325574591316,1.4519326553182967,-1.7897698120200267,-2.631440613158298,1.76141629451598,-2.028126056333145,0.021465285764041078,2.6344128599868633,-0.9996063349991235,2.0951577358000137
"yet though i love thee in such selfish fashion ,<br>i would wait on thee , sitting at thy feet ,<br>and serving thee , if thou didst deem it meet .<br>and couldst thou give me one fond hour of passion ,<br>i 'd take that hour and call my life complete .",1.1128707379479663,1.1128707379479663,-0.637968653072662,0.27579475852960594,-1.7580073423656601,1.0368599784453454,-2.261106619375255,0.6460221176594177,0.6966849458923815,0.9116583656682247,0.6568334954656918
"and such a brightness in his eye<br>as if the ocean and the sky<br>within him had lit up and nurst<br>a soul god gave him not at first ,<br>to comprehend their majesty .",-2.1016045733022954,-2.1016045733022954,2.253573320910701,-2.4939720597981245,-3.215748743763312,-1.5947313819154396,2.0569762629494956,2.280130000712583,1.0263003083424551,4.0105226941054175,-1.3237446731793034
"... step by step and stair by stair , <br>that withered woman , gray and white and brown —<br>more like a trunk by lichens overgrown<br>than anything which once could have been human .<br>and ever as she goes the palsied woman",-1.0387276942270198,-1.0387276942270198,3.34607719749295,-1.4492722304280639,-1.8091191594017448,2.8414711153239964,1.5974696637640453,-3.467847947164403,1.299600707666805,-0.6589106480446321,2.727034685834421
"i never tire, i am never bored!<br>i never even faintly dream that no!<br>i always fancy that perhaps. i hoard,<br>i treasure up, i treasure others, all,<br>because they always change, because they are,<br>alas i ever tire! i am) call,<br>because i cannot rest. because my car,<br>because it tires quickly, tire, oh,<br>i never really tire even though.",1.8884325439148189,1.8884325439148189,-0.9259600726416957,-0.19476099165973626,-0.6200005468814968,0.8167002804002194,2.858071359224988,2.1786381376194295,1.8749321698075805,0.9623786726150441,3.257311497413189
"if , for the age to come , this hour<br>of trial hath vicarious power ,<br>and , blest by thee , our present pain ,<br>be liberty 's eternal gain ,<br>thy will be done !",1.5609842001478171,1.5609842001478171,0.08638236643183571,1.0262661902121566,-4.331146448131884,-1.6402957193564875,-1.3496933613028974,-2.060399082368569,-0.5660162043267827,2.7655446476969354,-0.012811197971763033
"the fence ; and then the path that goes<br>around a trailer-tangled rock ,<br>through puckered pink and hollyhock ,<br>unto a latch-gate 's unkempt rose ,<br>and door whereat i knock .",-2.6359326981947513,-2.6359326981947513,3.5477513870928363,-0.19477389665764067,0.048253798408732625,-1.7490625525862455,-2.8056010813490877,-0.5256244449579468,0.06745446394827838,1.1485395480128207,0.3636132604583275
"all death — and men who see a drunken grave <br>weeping ! i 've turned to cleare me for a name <br>the lowliest duties quite distressed <br>though that sweet angel , whose early sight",-1.1986860231821084,-1.1986860231821084,2.2310993149505745,1.1566660335880563,-2.39883687890465,2.490682031621745,-3.051014595765376,-1.2917163309025597,-1.0030253484483436,0.8560378930752196,0.3967506457994324
"or even care about decision making ! <br>they wanna play around and calculate. <br>so many people over there creating, <br>that never ever could eliminate. <br><br>not challenge any drug delivery, <br>or something static from an index matching ! <br>we need another new utility ! <br>my body full of heavy metal casting.",-2.691126799934638,-2.691126799934638,0.9094575474867,2.749394074735528,-1.173676762532174,0.16216296932214042,-2.158852836017398,-1.7108430453976309,-1.9240313453623072,-0.49465798127458277,-1.2057960189649233
"the castle of our desire vultures we should shun <br>and dark elb in the open field <br>by worshippers of dim and tranquil deep <br>the garl and the stones of mroud lincoln, may'st thou nought <br>the heat and burthen of the fields and",-1.6188708950803978,-1.6188708950803978,1.9083325152880133,0.7545504269437316,-4.776127512654553,1.3355675976822659,-0.31012298972178093,-0.4228014879414145,-0.11121727777504668,-1.0682538455439001,-2.0301835986758467
"“ to me , what will i to do ? <br>“ the army is far as he is here , <br>and i have none , <br>and the gift that i had seen",-1.2396603361005825,-1.2396603361005825,2.648230484460888,0.639787926091755,-4.138036160256385,0.0008179476363858127,-3.3150809725402524,-2.023215194704765,-2.162041630128998,2.2348761096425798,-0.6246411621529198
