poem,all,coherent,grammatical,melodious,moved,real,rhyming,readable,comprehensible,intense,liking
"the castle of our desire vultures we must be seen <br>the castle with a watery lustre on the floor <br>and the wanderer to the steps of the stones <br>with all her cruell wanders are of nought <br>meanly he finds himself,— the hardly he",-1.932536059779128,-1.932536059779128,1.5019122044669326,0.8534375896112565,-2.272207568116105,0.2746796109918827,-2.190367241840925,1.1786932223856414,-1.6376568881583566,0.47260143879155536,0.4215757542999275
"“ o my soul , make the song of the sea ! ” i cried .<br>“ how it comes , with its stately tread ,<br>and its dreadful voice , and the splendid pride<br>of its regal garments flowing wide<br>over the land ! ” to my soul i said .",0.41569412800462224,0.41569412800462224,1.2984334065242966,0.7470479280761472,0.3951948623772558,-0.2195505961509027,0.5191824372940382,-0.09523883551274295,1.407965471836614,1.4257653893424025,-0.8049500854916406
"to-morrow she will toil from floor to floor<br>to smile upon the unreplying poor ,<br>to stay the tears of widows , and to be<br>confessor to men 's erring hearts ... ah me !<br>she knows not i am beggar at her door .",-1.3359846888093874,-1.3359846888093874,3.547630701145024,0.08358218547523123,-0.03940611033251486,1.6553649763457183,2.3593536093491267,0.9113587879791117,-0.2522000350334148,1.8015140051970289,0.06745675613475677
"the castle of our desire vultant we should find <br>that beam of all the world away at me <br>mereful and idly desired to be seen <br>the castle where the holy graisies areof this poor ground <br>vale, mistresses o'er, received not better than",-2.2162598965311933,-2.2162598965311933,1.724121819508089,-0.38660562523418124,-2.9762809355188855,0.4348891346659838,0.1868438727548298,0.25181508908532574,-1.9990764691047875,1.1676780738463632,-1.6229588112027338
"then let us fight about , dumourier ;<br>then let us fight about , dumourier ;<br>then let us fight about ,<br>till freedom 's spark is out ,<br>then we 'll be damn 'd , no doubt , dumourier .",-1.9798691483900133,-1.9798691483900133,0.05947613540921018,-1.8123823250979751,-3.55573865879358,0.8633201514324521,-1.978025510170723,-0.7362341305026051,0.8596768657684134,4.132514100684273,-0.7936770515966651
"you on that one good tongue can say ,<br>and give a new , race , by given .<br>with had thy glory i can raise but war ,<br>give me here , when sons happiness be sever . ”<br>for the pleasure nought within a babe ,<br>gore in the boast",-0.4389063439679283,-0.4389063439679283,1.4849001385573646,-0.11837057019625877,-3.2615704231308618,-1.2339395869675216,0.537688903565559,-0.5398366504740731,-2.7692099746816905,2.6372570172406404,0.9127115530657207
"how strange the lustre of spring , <br>and in the west the world hath ceased to be , <br>and i shall not be dumb <br>in what i am , i say , have i found",0.1771907631655076,0.1771907631655076,0.872173767765024,-0.733579963525949,-1.6305066738747,0.32713392350355813,-0.8948290714944529,-0.012341376128060952,-1.00360751139586,0.051108572830121164,0.30566468494712185
"the stars are silent and the stars in the sky . <br>i cannot find it , i am content . ” <br>“ a little fish , a little bit of red , <br>and the wind has a",-1.2003976740256137,-1.2003976740256137,1.4052642396574755,-0.8609302570308216,-0.061879247596980165,4.939222911660952,1.8764249408764662,0.10822737977762978,-0.8053267216318666,0.4758572153773715,2.236406163405339
"( the child of the scene by my once<br>father of the heavens will crush :<br>this god alone this god of the father . man come as they ample<br>come forth in the , judgment , majesty than there is no more tear<br>than the fond neat",-3.002549155502589,-3.002549155502589,-0.23330342202234117,-2.318105053443924,-2.865454187567932,0.3828883648713183,-0.7540951431733167,-0.7883933598176972,-0.9660229785474282,1.2599754232836053,0.579935778469411
"however, never even hinted what,<br>exactly happened during those. and we,<br>of our confusion only vague. i cut,<br>however often, pages out my book,<br>until, exhausted i decide enough.<br>enough. i finish writing, turn to- look,<br>erase again. i finish, read by rough,<br>dictated copy. after twenty years,<br>the only person i expect. my ears.",-1.1770350390985456,-1.1770350390985456,1.4004441073167846,-1.85520309611447,-0.8601652440047519,1.4655057284134845,-0.4665251873286897,-0.17399344297796362,-1.767563255784323,1.647924726207678,0.7966629997020392
"not this!— what is thy witness for my fame<br>i think of all the merits as i see<br>it may be ever in it— and to be<br>with ages, in the desert, and a name",1.2095766229758036,1.2095766229758036,0.9609946834093339,0.05606766689520385,-3.2735308501599887,-0.3046096314634634,3.9129574854902374,-2.232869178119591,0.7277495363975104,1.546624431387352,0.7624455880525067
"the summer sun rides high and clear ,<br>( the day is long , so long ,)<br>how long it must be ere it grows to a year —<br>how deep the sorrow that finds no tear ,<br>but only a wail of song .",1.3975142415180124,1.3975142415180124,2.299345345447879,0.36847358839717265,0.7914606991352702,1.809417492939093,-0.5006967887153563,2.570691737398702,-1.627786376557802,0.8304376172300424,2.910475981242889
"the golden locks are silvered now ,<br>the blushing cheek is pale and wan ;<br>the spring may bloom , the autumn glow ,<br>all 's one — in chimney corner thou<br>sitt'st shivering on .—",0.48902491117120056,0.48902491117120056,1.616391231090675,1.1032114291389035,-2.1090420214042447,2.176057259008011,0.17072502513561608,-2.1752618500762924,0.009307131529514234,1.864508431661391,1.0000222236013327
no more that beam one likeness is the way <br>so was the with them once so much <br>and as from all their seats of doubts and ray <br>looked not,-0.6948540775659262,-0.6948540775659262,3.7428105810936962,0.5335381854915936,-1.53137405820188,0.25312046792757004,-2.3360791345742937,-3.9919051866918847,0.6937908711799734,1.3754701473690625,1.2308817939529317
"lord dusiote fled the court and land ,<br>he crossed the woeful seas ,<br>till his traitorous doing seemed clearer to burn ,<br>and the lady beloved drew his heart for return ,<br>like the banner of war in the breeze .",-0.6521487199191249,-0.6521487199191249,0.805425777004929,-0.8189007893363273,-1.4473697211420282,1.00706197177227,-0.9139597795459632,0.24317286264062807,-2.1196512132602474,-0.20601612390942978,-1.742421632573775
"the other doctor, after reading this,<br>remarked, with something of surprise that short,<br>heroic life had not dissolved the bliss,<br>and even comfort of his office- suite,<br>in little pellets into whose effect,<br>alas, we had been led to fancy sweet,<br>and happy, happy happy, in its checked,<br>confined perfection. even mr. burke,<br>the other doctor, who observed that work.",0.09465729784705608,0.09465729784705608,1.308164935753651,-0.17610778116134973,-0.9257937271779353,2.408355825858616,-0.23497696498174342,0.7891521717423542,-0.6383724420037634,0.2945864010373053,-0.0018334856247384111
"o beauteous maid , my heart is thine ;<br>i lay its dearest offering at thy feet ;<br>i burn its sweetest incense on thy shrine ,<br>for thou , sweet maid , art all divine ,<br>for worship thou art meet .",0.04596931209295207,0.04596931209295207,1.5762610334083877,0.2998497450112823,-1.781725264103968,1.4563417930506806,-1.2832735742916894,0.9351514194765476,0.45989799159368744,2.130257550297764,2.7246675916682213
"because... i don; because you never had,<br>i never needed, i... because i knew,<br>i never needed; therefore never) ad,<br>amen, i, being always always; ad,<br>amen, you, always having; i am not,<br>because i am you always; i am glad,<br>i never wanted, i have always got;<br>because i never really wanted ( you,<br>you always having, ever wanting) to.",-2.746946946321243,-2.746946946321243,-1.3171298622878977,-0.24591542230792432,-2.368716297371032,0.959927793262708,-0.7292071890745873,-1.3124705845414892,-1.3319224824080267,1.5916718920739865,-0.4918113720358514
"knife eager , for a proud heart ,<br>breaking peace on the chords , our children can ,<br>as is that all hope that join him fain .<br>in love has no one door where no lent to thee<br>that i weave a subtle torch<br>my cousin ,",0.3740767412737289,0.3740767412737289,1.7807922739906514,-2.126970053512177,-1.252590849227577,1.5072409899122081,-2.380193866939207,0.9166516115043915,-0.9611141986864583,1.5788067734695366,-3.954453944379249
"because they were afraid. the second time,<br>indeed before another person may,<br>according as the holy scriptures crime,<br>instruct. moreover, even after they,<br>because afraid, the second persons, may,<br>themselves instruct themselves by hearing say,<br>moreover even they, because they they,<br>themselves, themselves instruct, because they are,<br>themselves instruct because of love which far.",-0.5014181698578776,-0.5014181698578776,1.3132549489951069,-1.0370219630742863,-1.8121810968416519,1.5623680522546644,0.4946910906047116,-0.259194303143242,-1.4176503310472666,-1.2647400927936,-0.737733363028221
the castle of our desire vultures we must be seen <br>the castle with its dark and silent thought <br>we could not open to the ravish 'd cell <br>it might for our poor hearts some reverend locks may find <br>with mantling crags and night to the beaute,-2.4379318067831317,-2.4379318067831317,0.9592919561512251,-1.117275023867722,-1.8285498786733185,1.1068026013687187,-0.9630624156213622,-0.8656970237251415,-2.766033854673542,0.45676541072028964,-1.4356837938643165
"but , each being ready to talk , i suppose ,<br>order ! order !<br>they cried , for the chair !<br>and , much to their wonder , our friend arose<br>and fastened his eye on the eye of the mayor .",-0.8207138463479802,-0.8207138463479802,3.229639788459562,0.11291962010498216,-1.5140196224710234,1.4052111528336728,-0.7664717789995557,1.1081736569305258,-0.36821025128205204,2.109602312858965,-0.4109804198871872
"the castle of our desire vultures we must be proud <br>we saw once at the inns of time <br>the hangiest and the meanest trillium we could not seen <br>the verily of a tower, the midnight grass <br>the lily, the aisles stretch of",1.0046762138152872,1.0046762138152872,-0.5019516313767733,-1.0754887165038023,-1.6850794511928853,-2.011260269958328,-0.7027548926170722,0.4431930629170107,-2.812983099188084,0.08430343967149391,-1.8096258036814665
"an ocean full of virtual machines, <br>we know that there is nothing really stable ! <br>i never mention those enormous genes ! <br>not even having any other nasal. <br><br>these very little silver mountain root, <br>for flying children making high formation ! <br>whose hands are swinging on an alto flute ! <br>a thousand planets under concentration.",-0.0797800214257133,-0.0797800214257133,0.9312948128848044,-0.6342546024256538,-5.294892718079987,3.0206546155963405,0.8791778097236939,0.11505552840625628,0.579539781002136,0.6484788379270551,2.6730666760711963
the sun shall shine the sky — <br>the sun is new ! <br>the world is far too wide to understand <br>the very day that i had loved so long,-0.20495209310914803,-0.20495209310914803,0.5188879126716017,-0.61671664516299,-4.076412533098785,-0.64660148009697,0.5611161779280788,-0.38325010810956645,-0.17332413446581893,1.9743258048615062,0.3088332841697412
"and thus his counsel for this spark i call <br>and home in rage from prison deeds to flatter <br>for some , with fix 'd regard the prince prepares <br>the strange , as did not shed apart",-2.553284997893981,-2.553284997893981,1.4813079368154054,-0.6924790396810092,-1.3964163111289793,1.1517933431700096,-0.756742413877716,-0.2589479317918645,-0.5386802068375214,0.8880812984229105,0.14712986795232966
"first published by the mouth ,<br>on a prize living fast<br>that stone with sweeter wind thanks the sea ,<br>‘ how should the wondrous pine died too so so<br>that you home again ! i have",-1.5086165274809218,-1.5086165274809218,1.888632775171374,-0.3149292061867305,-1.9934125576957704,0.7600391069265295,1.1104454763622857,1.1141547294676173,1.8872130747197486,-0.5033556121535406,0.35744794784311523
"ah me ! for the land that is sown<br>with the harvest of despair !<br>where the burning cinders , blown<br>from the lips of the overthrown<br>enceladus , fill the air .",-1.6248125871152928,-1.6248125871152928,1.8483949252977534,2.228888453172979,1.1006207152291083,0.8279515506088811,-0.10546912454127778,1.6024993951455084,-0.7410844573909541,-0.2853834566456205,1.5096955725856886
"indeed. the others are the trouble, they,<br>because of having given trouble to,<br>the many, who themselves are troubled day,<br>and evening, by their many children. they,<br>moreover, are the trouble, for besides,<br>the very many children they have slay,<br>because they wander after having rides,<br>and coming into certain places. they,<br>besides that many suffer pain from grey.",-1.022112506504577,-1.022112506504577,2.5660655414407123,0.016450646886918708,0.6047562917128152,2.1195736213573886,-0.6044825149017944,1.130973474030978,-0.18552709196942832,-0.9464433064129318,0.9873638265753609
"oh , that languishing yawn !<br>oh , those eloquent eyes !<br>i was drunk with the dawn<br>of a splendid surmise surmise —<br>i was stung by a look , i was slain by a tear , by a tempest of sighs .",-1.0300857844889888,-1.0300857844889888,2.2120948218151986,-0.5471624812264088,-0.6214752858757938,2.0211125881261243,0.08768475264936959,-0.299420439683796,-0.0023271897337074025,0.11602444428058127,0.5444151877255348
"or dancing at a summer matinee. <br>and from an early evening invitation, <br>that very lovely little music play ! <br>this letter gives my number one ovation. <br><br>no need for me to wait until november ! <br>i never wanna see another scene, <br>where it ever happened by september ! <br>the world is such an awful dance routine.",0.29541586923124413,0.29541586923124413,1.7811510344760544,-1.3301005458919941,-1.2786117283232683,4.09522718282694,1.624343791664955,0.42811251422853647,-1.554811480918901,1.4887970114748537,0.2947111714251452
"for moonlight of silver and sunlight of gold<br>glint the orchards of lemons and mangoes ,<br>and the ladies , we 're told ,<br>are a joy to behold<br>as they twine in their lissome fandangoes .",0.690680432277422,0.690680432277422,0.820607813880593,-1.0278040989740758,-2.0613807799519215,4.706411548497202,-1.6417751588620402,0.09389409055156572,-0.15672514402055238,-0.7148036292971559,0.7862657866035064
"i heard a vesper-sparrow sing ,<br>withdrawn , it seemed , into the far<br>slow sunset 's tranquil cinnabar ;<br>the crimson , softly smoldering<br>behind the trees , with its one star .",-0.25825884831970936,-0.25825884831970936,-0.06341834226991866,-1.1849653131413103,-1.3880242295561354,2.6116710894022868,-2.1121390701803846,-4.255379026347839,0.8335903048828031,1.8800448752902308,1.3507534518876225
"without delay or wonder was aware,<br>that something very strange was taking be,<br>indeed he had been watching her with care,<br>and wondered greatly, whether it was not,<br>perhaps it had already taken place,<br>and even questioned his beloved and caught,<br>but she remained composed and silent face,<br>and only answered, that she only knew,<br>and trusted very dearly that she do.",-1.2560420628557978,-1.2560420628557978,3.5028831553896493,2.6332933313983973,-1.4177180216703045,2.2461375407587485,-1.630197609662461,0.5159581219745085,-0.0998611055359988,2.2000535091527986,0.8499032228458986
"in death we all are equal , great and small<br>brought to the common level of the dust ;<br>there is no glory that survives the years ,<br>nay , nay , alike we shall be as we must ;<br>sleep and forget .",0.7159516361973288,0.7159516361973288,1.7086031161000539,1.6123052020524924,-0.9514528180154904,1.3345581184322355,0.9538482728840848,0.6337046949309066,-1.3248675289946372,3.9457938521460356,-2.158417612366759
"for never the north in the low tune<br>pass yet a rest for heaven smile ;<br>and cheek do him all , and tell them say ,<br>and always he is and the children 's father .<br>he nottingham the bloom of those broad seas ,<br>unto one joy is",0.8496219729790937,0.8496219729790937,1.5505488376542094,-0.022834325518910095,-0.9904402350708089,3.8583377144282203,0.7368812004321417,0.3595461198723128,-1.193316255563206,1.0710635897906728,0.4201325519451778
"i walked a home , and i <br>watch the great river 's tide , <br>and the clouds are scattered clear , <br>the branches of the mountain 's breast ,",-0.780911980174234,-0.780911980174234,2.788048919658773,-0.42024640035038946,-0.9420795064317673,1.471223146410884,0.12436725279937952,-1.0869913741764161,-0.29620318783791644,2.6615014068228424,2.548653496181659
"the castle of our desire vultures we should defend <br>and blot the modest el vines with fraternal rage <br>causing our poor hearts with loud prayer and fine <br>now the poor, in watery lustre daine <br>and the poor india, shicke by a waste of",-1.8483980980790742,-1.8483980980790742,1.892690671390737,-1.4751609549985485,-2.5929821267560738,0.8931243807419811,0.08662157705611609,-1.9294558248158975,-1.5039896817654677,-1.9997570813783938,-0.3404256996083583
"and so divine, disposed as it so still<br>it is not punishment with his apart<br>such is my self, the patron of your will<br>and to attest me— worthy of the art",-0.6990675862565447,-0.6990675862565447,3.4104634278440136,-0.7241184704132029,-1.3769298030796107,0.3935992788948893,1.6702003508472296,1.7135702057860926,0.46488020166555954,3.161443537479731,2.7122260854244207
"sometimes wind and sometimes rain ,<br>then the sun comes back again ;<br>sometimes rain and sometimes snow ,<br>goodness , how we 'd like to know<br>why the weather alters so .",-0.9200133839931461,-0.9200133839931461,0.20384100435400862,-0.02816552050663299,-1.995230700417065,0.8607005841149695,-1.1586155234007636,-0.12333830217279464,1.9579694314224754,0.5100968029693153,-1.0007147463605357
"pity for such as peace his answer then <br>that more but mutual vengeance may invoke <br>feel these , but if thou shouldst great errors find <br>which , looking out imploring to the thief",-2.5950362123243687,-2.5950362123243687,-1.4598806198719994,-0.5826891676960988,-2.2197486441224337,1.0962720409441593,-1.3343057840508727,0.09822349069845669,1.4283561780230583,0.7232010296732756,-1.3508024195571697
"we ever wanna even hula hoops ! <br>i gotta super human folding blade, <br>so busy running through electric loops ! <br>not working at my own consumer grade. <br><br>this very little giant dynamo. <br>or maybe love is never really real, <br>but yet it only likes to move too slow ! <br>an old piano on the daisy wheel.",-1.4212841784491226,-1.4212841784491226,1.9375148509784594,-0.010261273112950869,-1.713255667239527,0.9596294316663571,1.1057875698660884,0.6617689816984835,1.0413402262711997,1.8742551902212754,1.7956671311613597
"i am ojistoh , i am she , the wife<br>of him whose name breathes bravery and life<br>and courage to the tribe that calls him chief .<br>i am ojistoh , his white star , and he<br>is land , and lake , and sky — and soul to me .",-2.433134675077555,-2.433134675077555,0.496633712846324,2.9405698657555894,-1.4593289524497544,1.8487083282089807,-0.23528107492469102,0.421913657664976,0.7325776480685364,0.9171648906168931,1.5268115708022039
"i shall not see thee , love , love , and be not love ! <br>and if she does not die for you ! <br>i look at the right with the same , <br>to be a sort",1.2585217648138636,1.2585217648138636,1.451019162844124,-0.6171963526035676,-1.2255623884454205,0.5375012716007667,-0.5498835426650773,1.1359597808523225,-2.0821089949309886,1.0681271191488573,1.2758910967953976
"then , why art thou here , my bird ,<br>away from thy young , helpless brood ?<br>“ to pay thee with a song ,<br>just to let me pass along ,<br>nor harm me , as i look for their food ! ”",3.2513248581924703,3.2513248581924703,0.49164718521844275,-3.6603749942953985,-0.8239592040851917,1.3525826056256212,1.0471716610239108,-1.2478114094516242,1.459423992936355,-0.3747881291464675,0.00996137876028249
"the wind and the moon was a dream of the air ! <br>a thousand years have gone away <br>in the weary of the sea ? <br>the sound of the sun and the dew ,",-3.164012459739717,-3.164012459739717,1.478319573170361,-0.14308250812662182,0.46761977778102726,2.541690426079392,-0.33817929939353797,1.020133242851156,-1.1414245990358216,-0.11929958981401378,-1.1900853274089536
"but pure and glistening sand<br>border the placid wave ;<br>he leaves the dangerous land ,<br>to find a treacherous grave :<br>it was deep , you 'll understand .",-1.0727307289744092,-1.0727307289744092,0.9334409607906273,-1.4473659473372553,-1.0139750913234944,3.357692010032088,0.13464609200810224,1.1800330659059897,-0.5172714670162358,1.5872045723958264,1.3479998138769254
"the castle of our desire vultures dozed <br>a pleasing chrysalis, far envuiled of snow <br>under the sky it did containe to our desire <br>we, all of it, an heire, infinite joying <br>the modest elia withered to the colde",-1.775783062632205,-1.775783062632205,-0.34932817388450227,0.08087992593151405,-1.6353150593403274,-0.22562733426104392,0.5795655111094886,-1.924778056549776,-1.2124192998463044,0.7321603287404713,0.9683094838787152
"‘ tis well i know that i am young ; <br>i have lived in a little while , <br>and i think , ‘ tis not . ’ <br>‘ it is not for the right . sat and",-2.2815311035377883,-2.2815311035377883,-0.01735248063905532,-0.9866042922919057,-1.3728334316731692,-0.520657946124027,-0.07028579480739332,-2.5252169538195446,-0.6362143014194745,0.9175713365391163,1.5806557792013691
"if i could only stay <br>with your eyes , with a brief embrace , <br>the look of her eyes . <br>no man knows the fair and free ,",-0.08179484232044258,-0.08179484232044258,1.603224057348765,-1.0882260911644044,-0.8122371066836258,1.1398804591485585,0.3620040432342394,0.007397465462942425,-2.326958311168724,-0.5730511638292767,0.9160948713442099
"but inland from the seaward spaces ,<br>none knows , not even you , the places<br>brimmed , at your coming , out of sight ,<br>— the little solitudes of delight<br>this tide constrains in dim embraces .",-0.8216285448239027,-0.8216285448239027,1.4114747324739436,-2.2322351325072423,-2.382622202620361,-0.08501215344501253,0.6820960573354365,-0.3621509881775107,0.3187501934274774,1.2550303324477132,0.7779370491788753
"at him the sun made throne away ;<br>the ages , the fatal man thro ’ unknown ,<br>was fun times , she could not ,<br>then she kneeled in him cries from mrs. ;<br>the fancy of it 5<br>the face that tribe",1.4826091716495142,1.4826091716495142,-2.7802295846848053,-2.702032011345776,-3.016059477014004,-0.5270468169669495,-3.0811216327874518,-1.315240357059093,-0.2970489870555448,1.7971364376938248,-1.2128916082998917
"nor can we find all much as i must say<br>yet was the woman such as he was fast<br>and she to know that, he might try his way<br>and she most blest, all ev'ry thing to rest",-0.06559933808822362,-0.06559933808822362,0.37489050397699003,-0.1699821742252654,-1.5493924910158265,3.691711716060714,0.1267271904433088,-1.110903266562974,1.835001559453666,0.26979463647017965,0.3510355244096727
"“ bystanders reason , think of wives<br>and children ere they risk their lives .<br>over the balustrade has bounced<br>a mere instinctive dog , and pounced<br>plumb on the prize . ‘ how well he dives !",-0.5540160003788642,-0.5540160003788642,0.20060203161445098,-0.5958843096976187,-2.302932724681894,0.687425096111026,-0.06059751347669191,-3.506100668613668,0.09481103465551534,0.8625933116216576,0.9851258670106903
"“ yet let him keep the rest —<br>but keep them with repining restlessness :<br>let him be rich and weary , that , at least ,<br>if goodness lead him not , yet weariness<br>may toss him to my breast . ”",-1.53214441617184,-1.53214441617184,0.2788648879034222,0.9246561805271566,-0.5630408554356189,6.199657077021435,0.5387658070470722,-1.3354191428505209,-0.18310677871083733,0.7177361438659723,2.4715356922717793
"“ now , a pool stream a sound is led , the sun <br>the child 's broad hollow then a phantom feels <br>beneath me rack the barrier day <br>charm , from whence we 'd keep or slake my will",-0.6675521423348887,-0.6675521423348887,3.022234281953565,1.0297522844749583,-0.8896630533884403,0.9548976900908258,0.18130476906922782,0.4117887198460134,0.16221827062351227,-0.6925850918424571,-1.0996522070996855
"the castle of our desire vultures we should shun <br>and dark elb in the open field <br>by worshippers of dim and tranquil deep <br>the garl and the stones of mroud lindenus, who wove <br>now tsil lattuled, and yet a stone",-1.6329479507299147,-1.6329479507299147,2.4374357360892938,-1.4194982392418927,-1.861685787376756,1.5930304183522546,-0.48953456990108457,-0.2835387975981529,-0.9744841201709893,-0.411822149004209,-0.6446080734982231
"the sunny showers , the dappled sky ,<br>the little birds that warble high ,<br>their vernal loves commencing ,<br>will better welcome you than i<br>with their sweet influencing .",-1.820694402302063,-1.820694402302063,1.0806547902003512,-1.5965321348382262,-0.3796979565374847,0.7406861812026011,3.1479093729798264,-0.13583968045770733,-6.292320260712152e-05,1.2119786968517317,1.201521869381988
